{"type":"config","name":"前后端代码质量优化（符合最佳实践）","metricName":"total_issues","metricUnit":"","bestDirection":"lower"}
{"run":1,"commit":"305d609","metric":108,"metrics":{"golint_canonicalheader":8,"golint_errname":1,"golint_errorlint":12,"golint_forcetypeassert":3,"golint_gosec":2,"golint_intrange":3,"golint_modernize":37,"golint_nilnil":3,"golint_perfsprint":18,"golint_prealloc":3,"golint_recvcheck":7,"golint_usestdlibvars":3,"golint_wastedassign":7,"golint_total":107,"eslint_problems":1,"eslint_errors":0,"eslint_warnings":1,"tsc_errors":0,"measure_s":36},"status":"checks_failed","description":"基线：总问题 108（golangci 107 + eslint 1）。checks 失败的唯一原因：repo 自带 golangci gate 有 2 个既有 gosec G115 问题（预期内，首次修复后即绿）。","timestamp":1786871594292,"segment":0,"confidence":null,"asi":{"hypothesis":"baseline","next_action_hint":"修复 internal/apps/edge/observability/linux.go 的 2 个 G115 gosec 问题后 checks.sh 才能通过；之后每次迭代即可正常 keep/discard"}}
{"run":2,"commit":"f1f6bb8","metric":106,"metrics":{"golint_canonicalheader":8,"golint_errname":1,"golint_errorlint":12,"golint_forcetypeassert":3,"golint_gosec":0,"golint_intrange":3,"golint_modernize":37,"golint_nilnil":3,"golint_perfsprint":18,"golint_prealloc":3,"golint_recvcheck":7,"golint_usestdlibvars":3,"golint_wastedassign":7,"golint_total":105,"eslint_problems":1,"eslint_errors":0,"eslint_warnings":1,"tsc_errors":0,"measure_s":38},"status":"keep","description":"修复 internal/apps/edge/observability/linux.go 的 2 个 gosec G115 整数溢出转换：helper 改为接收 int64 b，用 gosec 认可的饱和乘法模式（uint64 域乘积 + 上界比较），去掉原 //nolint:gosec，语义不变（Bsize 恒为正）。repo 自带 gate 首次全绿。","timestamp":1786872064145,"segment":0,"confidence":null,"asi":{"hypothesis":"修复 gosec G115：multiplyUint64ToInt64 改为 accept int64 b 并采用 gosec 认可的饱和乘法模式","insight":"gosec G115 不接受分支上界证明（a > MaxInt64/b），但接受先算 uint64 乘积再 if v > MaxInt64 饱和的模式，无需 nolint","next_action_hint":"下一步批量清理 modernize(37)/perfsprint(18) 等自动可修复类别，用 golangci-lint --fix 后人工核对 diff"}}
{"run":3,"commit":"b76f707","metric":74,"metrics":{"golint_canonicalheader":8,"golint_errname":1,"golint_errorlint":12,"golint_forcetypeassert":3,"golint_gosec":0,"golint_intrange":3,"golint_modernize":5,"golint_nilnil":3,"golint_perfsprint":18,"golint_prealloc":3,"golint_recvcheck":7,"golint_usestdlibvars":3,"golint_wastedassign":7,"golint_total":73,"eslint_problems":1,"eslint_errors":0,"eslint_warnings":1,"tsc_errors":0,"measure_s":38},"status":"keep","description":"modernize 37→5（-32）：interface{}→any、内置 max/min、slices/maps 辅助、strings.Cut/SplitSeq、strings.Builder（修复 mail.go O(n²) 拼接）。逐 hunk 核对语义等价；omitzero 冲突修复被自动跳过（wire 格式不变）；手动清 4 处遗留 sort import + 2 处 QF1012。","timestamp":1786872502383,"segment":0,"confidence":17,"asi":{"hypothesis":"批量应用 modernize 自动修复（interface{}→any、max/min、slices.Sort/Contains、strings.Cut/SplitSeq、maps.Copy、strings.Builder）","insight":"golangci-lint --fix 会把 omitempty→omitzero 的冲突修复跳过（2个文件保留原 tag，wire 格式不变，好）；但 fixer 会遗留未使用的 sort import，需手动清 4 处；mail.go 的 Builder 迁移附带暴露 2 个 QF1012，顺手用 fmt.Fprintf 修复。全部修复语义等价，已逐项核对 diff","next_action_hint":"剩余 modernize=5 应为 omitzero 冲突文件；下轮先处理 perfsprint(18)：先看 --fix 是否安全再决定"}}
{"run":4,"commit":"699e95f","metric":56,"metrics":{"golint_canonicalheader":8,"golint_errname":1,"golint_errorlint":12,"golint_forcetypeassert":3,"golint_gosec":0,"golint_intrange":3,"golint_modernize":5,"golint_nilnil":3,"golint_perfsprint":0,"golint_prealloc":3,"golint_recvcheck":7,"golint_usestdlibvars":3,"golint_wastedassign":7,"golint_total":55,"eslint_problems":1,"eslint_errors":0,"eslint_warnings":1,"tsc_errors":0,"measure_s":47},"status":"keep","description":"perfsprint 18→0：strconv.Itoa/FormatInt/FormatUint/FormatBool 替代 fmt.Sprintf、无动词 fmt.Errorf→errors.New、纯字符串拼接。全部语义等价（已核对 diff）。修正 fixer 遗留的 import 问题（引入 goimports 统一整理）。","timestamp":1786872884713,"segment":0,"confidence":3.0588235294117645,"asi":{"hypothesis":"perfsprint --fix：%d→strconv.Itoa/FormatInt、%t→FormatBool、%s+const→拼接、无动词 Errorf→errors.New","insight":"重要：golangci-lint v2 fixer 的 import 管理不可靠（删除/添加 import 会出错，53 个文件中 5 处报 undefined）+ 遗留未用 import。已安装 goimports（repo make format 本来就需要它），对改动文件统一 goimports -w 修复。后续只要用 --fix 就要记得跑 goimports -w","next_action_hint":"剩余大头：errorlint(12)、canonicalheader(8)（usestdlibvars 同类）、recvcheck(7)、wastedassign(7)。errorlint 需手工逐处判断；先做 canonicalheader+usestdlibvars（自动可修复但要核对）"}}
{"run":5,"commit":"d0414b4","metric":45,"metrics":{"golint_canonicalheader":0,"golint_errname":1,"golint_errorlint":12,"golint_forcetypeassert":3,"golint_gosec":0,"golint_intrange":3,"golint_modernize":5,"golint_nilnil":3,"golint_perfsprint":0,"golint_prealloc":3,"golint_recvcheck":7,"golint_usestdlibvars":0,"golint_wastedassign":7,"golint_total":44,"eslint_problems":1,"eslint_errors":0,"eslint_warnings":1,"tsc_errors":0,"measure_s":38},"status":"keep","description":"canonicalheader 8→0 + usestdlibvars 3→0：header key 改为 Go 规范大小写（wire 格式本就如此，纯代码修正）、HTTP 方法常量替代字符串字面量。","timestamp":1786873098921,"segment":0,"confidence":2.1724137931034484,"asi":{"hypothesis":"canonicalheader+usestdlibvars --fix：Header key 统一规范大小写、GET/OPTIONS 等方法常量","insight":"GitHub header 修正前后的 wire 格式完全一致（Go 在 Set 时本来就会规范化），纯代码层面修正，零行为风险；下次遇到同类 100% 安全","next_action_hint":"剩余：errorlint(12) 需逐处人工判断（其中 3 处 err != context.Canceled、2 处 %v wrap、若干 ==/类型断言）；recvcheck(7) 是模型接收者一致性；wastedassign(7) 删 TODO 赋值；intrange(3)/modernize(5)/nilnil(3)/prealloc(3)/forcetypeassert(3)/errname(1)/eslint(1)"}}
{"run":6,"commit":"ce28f63","metric":38,"metrics":{"golint_canonicalheader":0,"golint_errname":1,"golint_errorlint":12,"golint_forcetypeassert":3,"golint_gosec":0,"golint_intrange":3,"golint_modernize":5,"golint_nilnil":3,"golint_perfsprint":0,"golint_prealloc":3,"golint_recvcheck":7,"golint_usestdlibvars":0,"golint_wastedassign":0,"golint_total":37,"eslint_problems":1,"eslint_errors":0,"eslint_warnings":1,"tsc_errors":0,"measure_s":47},"status":"keep","description":"wastedassign 7→0：删除 7 处死初始化（snapshot.go 三连、push 三件套 content、format.go numStr），改 var 声明，零行为变化。","timestamp":1786873485497,"segment":0,"confidence":2.978723404255319,"asi":{"hypothesis":"wastedassign 7→0：删除 7 处死初始化（x := \"\" 后所有分支都赋值）改为 var 声明","insight":"replace 工具会归一化 replacement_text 的前导空白；对需要缩进的编辑直接用 sed/gofmt -w 处理更稳","next_action_hint":"剩余：errorlint(12)、recvcheck(7)、modernize(5)、intrange(3)、nilnil(3)、prealloc(3)、forcetypeassert(3)、errname(1)、eslint(1)"}}
{"run":7,"commit":"288b74d","metric":33,"metrics":{"golint_canonicalheader":0,"golint_errname":1,"golint_errorlint":12,"golint_forcetypeassert":3,"golint_gosec":0,"golint_intrange":0,"golint_modernize":3,"golint_nilnil":3,"golint_perfsprint":0,"golint_prealloc":3,"golint_recvcheck":7,"golint_usestdlibvars":0,"golint_wastedassign":0,"golint_total":32,"eslint_problems":1,"eslint_errors":0,"eslint_warnings":1,"tsc_errors":0,"measure_s":45},"status":"keep","description":"intrange 3→0 + modernize 5→3：for i:=0;i<len/N;i++ → range len/N（8 处）；time.Time 字段 omitempty→omitzero（wire 输出一致）；SplitSeq；min() 简化。刻意保留 lark.go omitzero（会改变 wire 行为）。","timestamp":1786873629461,"segment":0,"confidence":4.166666666666667,"asi":{"hypothesis":"intrange(3) + modernize 剩余（2 个 time.Time omitempty→omitzero + SplitSeq + min）","insight":"lark.go larkTextContent omitempty→omitzero 会改变 wire（普通 struct 无 IsZero，当前恒序列化，改后零值省略）—— 判定为行为变化，故意保留；time.Time 字段 omitempty/omitzero 输出一致，可安全替换","next_action_hint":"剩余：errorlint(12) 大头（3 处 != context.Canceled 需确认 runner 是否 wrap；%v→%w 2 处；若干 ==err / 类型断言）；recvcheck(7)；forcetypeassert(3)；nilnil(3)；prealloc(3)；errname(1)；eslint(1)"}}
{"run":8,"commit":"86fad02","metric":22,"metrics":{"golint_canonicalheader":0,"golint_errname":1,"golint_errorlint":1,"golint_forcetypeassert":3,"golint_gosec":0,"golint_intrange":0,"golint_modernize":3,"golint_nilnil":3,"golint_perfsprint":0,"golint_prealloc":3,"golint_recvcheck":7,"golint_usestdlibvars":0,"golint_wastedassign":0,"golint_total":21,"eslint_problems":1,"eslint_errors":0,"eslint_warnings":1,"tsc_errors":0,"measure_s":46},"status":"keep","description":"errorlint 12→1：3 处 cmd 入口 err!=context.Canceled→errors.Is（防御性，当前 runner 不 wrap 语义不变）；2 处 strconv.NumError 断言、1 处 viper 断言、2 处 ==io.EOF、2 处 ==redis.Nil、1 处 ==gorm.ErrRecordNotFound→errors.As/Is；8 处 %v→%w 保留错误链。刻意保留 telegram.go 单处 %v（原始错误仅作上下文文本，wrap 会改变 errors.Is 匹配语义）。","timestamp":1786873923775,"segment":0,"confidence":4.195121951219512,"asi":{"hypothesis":"errorlint 12→1：errors.Is/As 替代 ==/类型断言（防御 wrap），%v→%w 保留错误链","insight":"errorlint 结果在并行分析时一度不稳定（可能文件缓存竞争），多跑一次确认；telegram.go 的 %v 是刻意保留原始 HTML 错误为文本（只 wrap fallbackErr），判定为合理例外，不计为负债。错误链保留（%w）对多错误组合消息（manager.go、restart_unix.go、service.go）是净收益，调用方无 Is 匹配这些次要错误","next_action_hint":"剩余：recvcheck(7)、forcetypeassert(3)、nilnil(3)、prealloc(3)、modernize(3=lark omitzero 刻意保留)、errname(1)、eslint(1)"}}
{"run":9,"commit":"4ecec2c","metric":15,"metrics":{"golint_canonicalheader":0,"golint_errname":0,"golint_errorlint":1,"golint_forcetypeassert":0,"golint_gosec":0,"golint_intrange":0,"golint_modernize":3,"golint_nilnil":3,"golint_perfsprint":0,"golint_prealloc":0,"golint_recvcheck":7,"golint_usestdlibvars":0,"golint_wastedassign":0,"golint_total":14,"eslint_problems":1,"eslint_errors":0,"eslint_warnings":1,"tsc_errors":0,"measure_s":43},"status":"keep","description":"forcetypeassert 6→0（缓存 list 断言、relay/flared 中间件契约断言、图片压缩 flight 断言，全部带检查+安全失败路径）；errname 1→0；prealloc 2 处（另 1 处与 repo mnd 冲突，用命名常量解决）。nilnil 保留（not-found/可选结果惯例，含接口契约注释）。","timestamp":1786874283774,"segment":0,"confidence":4.043478260869565,"asi":{"hypothesis":"forcetypeassert(6处) → 带检查断言（middleware 契约破坏时 Abort 401/返回错误）；errname runtimeInitErr→errRuntimeInit；prealloc 2 处（uptimekuma、postgres replicas）","insight":"prealloc 与 repo mnd 门禁冲突（magic number 3）：用命名常量 baseTracingOptionCount 同时满足两者；nilnil 5 处判定为合法 not-found/可选结果惯例（含接口注释契约 + 测试断言），全部保留；用 --max-issues-per-linter=0 拿全量清单避免被默认 50 截断误导","next_action_hint":"剩余：recvcheck(7) 接收者一致性（需逐模型判断）、eslint(1) exhaustive-deps、modernize(3=lark omitzero 刻意保留+2 处待查)、nilnil(3 刻意保留)、errorlint(1 刻意保留)"}}
{"run":10,"commit":"73d8173","metric":9,"metrics":{"golint_canonicalheader":0,"golint_errname":0,"golint_errorlint":1,"golint_forcetypeassert":0,"golint_gosec":0,"golint_intrange":0,"golint_modernize":3,"golint_nilnil":3,"golint_perfsprint":0,"golint_prealloc":0,"golint_recvcheck":1,"golint_usestdlibvars":0,"golint_wastedassign":0,"golint_total":8,"eslint_problems":1,"eslint_errors":0,"eslint_warnings":1,"tsc_errors":0,"measure_s":45},"status":"keep","description":"recvcheck 7→1：6 个 GORM 模型 TableName 改为指针接收者（GORM 源码确认 reflect.New 判定 Tabler，兼容；模型单测通过）。MillisecondDuration 刻意保留（encoding/json 要求 Marshal 值/Unmarshal 指针的混合）。","timestamp":1786874445733,"segment":0,"confidence":4.304347826086956,"asi":{"hypothesis":"recvcheck 7→1：GORM 模型 TableName 值接收者→指针接收者，与其它方法一致","insight":"GORM schema.Parse 用 reflect.New(modelType) 判定 Tabler，指针接收者 TableName 完全兼容（已读 gorm 源码确认 + 模型单测通过）；仓库中 (Model{}).TableName() 字面量调用都在未改的类型上，无破坏。MillisecondDuration 保留：MarshalJSON 值接收者是 json 对不可寻址值的行为保障，UnmarshalJSON 必须指针 —— 混合是 encoding/json 硬性要求","next_action_hint":"剩余：modernize(3，含 lark omitzero 刻意保留 + 2 处待查)、nilnil(3 刻意保留)、eslint(1 exhaustive-deps)、errorlint(1 刻意保留)。下一步查 modernize 剩余 2 处并修 eslint 的 hook 依赖"}}
{"run":11,"commit":"111d290","metric":8,"metrics":{"golint_canonicalheader":0,"golint_errname":0,"golint_errorlint":1,"golint_forcetypeassert":0,"golint_gosec":0,"golint_intrange":0,"golint_modernize":3,"golint_nilnil":3,"golint_perfsprint":0,"golint_prealloc":0,"golint_recvcheck":1,"golint_usestdlibvars":0,"golint_wastedassign":0,"golint_total":8,"eslint_problems":0,"eslint_errors":0,"eslint_warnings":0,"tsc_errors":0,"measure_s":38},"status":"keep","description":"eslint 1→0：pages-source-card useEffect 补 t 依赖（next-intl 稳定引用）。modernize 补 1 处 time.Time omitzero。剩余 8 全部为刻意保留项。","timestamp":1786874578893,"segment":0,"confidence":4.3478260869565215,"asi":{"hypothesis":"eslint 1→0：useEffect 依赖数组补 t（next-intl useTranslations 返回稳定引用，安全）；modernize 补 1 处 time.Time omitempty→omitzero（输出一致）","insight":"modernize 剩余 3 处全部是嵌套 struct omitempty（client.go Release/Asset、lark.go Content）→ omitzero 会改变 wire，全部刻意保留。至此所有可安全修复的类别清零，剩余 8 个全部是有据可查的刻意保留项","next_action_hint":"剩余 8 全部刻意保留（errorlint 1 telegram、modernize 3 嵌套struct、nilnil 3 not-found、recvcheck 1 json）。下一轮做深化方向：测试代码质量（tests:false 之外）、或 golangci 附加 linter（gocritic 更多检查）作为新基准段"}}
{"run":12,"commit":"e5f6b0a","metric":33,"metrics":{"golint_canonicalheader":0,"golint_errname":0,"golint_errorlint":1,"golint_forcetypeassert":0,"golint_gosec":0,"golint_intrange":0,"golint_modernize":3,"golint_nilnil":3,"golint_perfsprint":0,"golint_prealloc":0,"golint_recvcheck":1,"golint_usestdlibvars":0,"golint_wastedassign":0,"golint_total":8,"golint_test_testifylint":20,"golint_test_thelper":3,"golint_test_usetesting":2,"golint_test_total":25,"eslint_problems":0,"eslint_errors":0,"eslint_warnings":0,"tsc_errors":0,"measure_s":37},"status":"keep","description":"基准扩展（文档化）：新增测试代码质量维度 25 处（testifylint 20 + thelper 3 + usetesting 2），生产代码 8 处刻意保留不变。新基线 total=33。","timestamp":1786874744438,"segment":0,"confidence":4.878048780487805,"asi":{"hypothesis":"扩展基准到测试代码质量维度（testifylint 20 + thelper 3 + usetesting 2 = 25）","insight":"刻意排除 paralleltest/tparallel（共享 DB/redis 状态 + 本环境无法跑测试，t.Parallel 有风险）—— 这是范围扩展（抬高门槛），不是 gaming；基准定义已写入 prompt.md","next_action_hint":"修 25 处测试问题：float-compare 3（InDelta）、require-error 3、encoded-compare 1（JSONEq）、empty 3、contains 1、error-is-as 3、len 3、go-require-in-handler 2、t.Helper 3、os.MkdirTemp→t.TempDir 2"}}
{"run":13,"commit":"63a24da","metric":8,"metrics":{"golint_canonicalheader":0,"golint_errname":0,"golint_errorlint":1,"golint_forcetypeassert":0,"golint_gosec":0,"golint_intrange":0,"golint_modernize":3,"golint_nilnil":3,"golint_perfsprint":0,"golint_prealloc":0,"golint_recvcheck":1,"golint_usestdlibvars":0,"golint_wastedassign":0,"golint_total":8,"golint_test_testifylint":0,"golint_test_thelper":0,"golint_test_usetesting":0,"golint_test_total":0,"eslint_problems":0,"eslint_errors":0,"eslint_warnings":0,"tsc_errors":0,"measure_s":39},"status":"keep","description":"测试代码质量 25→0：assert↔require 一致性（fail-fast）、float 精确比较→InDelta、Equal(\"\",x)→Empty、Equal(len)→Len、errors.Is/As→ErrorIs/ErrorAs、JSON 字符串→JSONEq、handler goroutine 内 require→assert（真健壮性修复）、t.Helper()、os.MkdirTemp→t.TempDir()（符合 repo AGENTS 约束）。","timestamp":1786875177918,"segment":0,"confidence":4.3478260869565215,"asi":{"hypothesis":"修完测试代码质量维度 25 处（testifylint 20 + thelper 3 + usetesting 2）","insight":"批量修复过程揭示 testifylint 默认 max-same-issues=3 会掩盖重复模式（len(entries) 出现 4+ 次、float64(3) 4 次），需 --max-issues-per-linter=0 反复收敛；全部修复语义中性（assert↔require 仅 fail-fast 差异，InDelta/JSONEq/Empty/Len/ErrorIs 等价断言，t.Helper/t.TempDir 纯改善）。go-require 类（handler 内 require→assert）是真正的健壮性修复","next_action_hint":"测试维度清零。生产代码剩余 8 全部刻意保留。可选深化：gocritic 更多子检查/staticcheck 更多（SA 系列）扫描、或 biome check 格式一次性提交、或前端 a11y（eslint jsx-a11y 已含于 next core-web-vitals 默认关闭项）"}}
{"run":14,"commit":"65c02ef","metric":8,"metrics":{"golint_canonicalheader":0,"golint_errname":0,"golint_errorlint":1,"golint_exhaustive":0,"golint_forcetypeassert":0,"golint_gosec":0,"golint_intrange":0,"golint_modernize":3,"golint_nilnil":3,"golint_perfsprint":0,"golint_prealloc":0,"golint_recvcheck":1,"golint_usestdlibvars":0,"golint_wastedassign":0,"golint_total":8,"golint_test_testifylint":0,"golint_test_thelper":0,"golint_test_usetesting":0,"golint_test_total":0,"eslint_problems":0,"eslint_errors":0,"eslint_warnings":0,"tsc_errors":0,"measure_s":36},"status":"keep","description":"基准扩展 exhaustive（文档化）+ 12→0：枚举 switch 补显式 case（全部与现有 default 行为等价，fail-explicit 防未来枚举静默落入 default）；source_tasks.go 为控制复杂度合并两个等价校验条件。","timestamp":1786875548060,"segment":0,"confidence":4.25531914893617,"asi":{"hypothesis":"基准扩展 exhaustive（12 处枚举 switch 显式化）+ 全量修复","insight":"12 处全部是 default 已正确处理、缺显式 case 的类型；补显式 case 仅为 fail-explicit（未来枚举新增不会静默落入 default）。source_tasks 补 case 后 Execute 复杂度 20→21 触发 cyclop，合并两个 ActionInvalid 条件（逻辑等价）降回 19。cyclop 与 exhaustive 的张力：显式 case 也计入复杂度","next_action_hint":"剩余 8 全为刻意保留。可再深化：sloglint 全量、govet 附加分析器、或前端 jsx-a11y/next 规则已有覆盖。也可将剩余 8 处文档化后收尾总结"}}
{"run":15,"commit":"d7b8f44","metric":8,"metrics":{"golint_canonicalheader":0,"golint_errname":0,"golint_errorlint":1,"golint_exhaustive":0,"golint_forcetypeassert":0,"golint_gosec":0,"golint_intrange":0,"golint_modernize":3,"golint_nilnil":3,"golint_perfsprint":0,"golint_prealloc":0,"golint_recvcheck":1,"golint_usestdlibvars":0,"golint_wastedassign":0,"golint_total":8,"golint_test_testifylint":0,"golint_test_thelper":0,"golint_test_usetesting":0,"golint_test_total":0,"golint_vetx_total":0,"eslint_problems":0,"eslint_errors":0,"eslint_warnings":0,"tsc_errors":0,"measure_s":37},"status":"keep","description":"修复 geoip/runtime.go 真死代码：ensureServerMMDB 的 os.Stat 错误被 if-init 遮蔽，`err != nil && !os.IsNotExist(err)` 恒为 false（外层 err 恒 nil），防御检查从未生效；改为显式捕获 statErr，stat 非 not-exist 错误现在正确返回。基准新增第 4 维度 govet nilness+unusedwrite（文档化扩展），当前 0。","timestamp":1786875949461,"segment":0,"confidence":4.166666666666667,"asi":{"hypothesis":"govet nilness 真实死代码 bug：ensureServerMMDB 的 stat 错误被 if-init 遮蔽，!os.IsNotExist(err) 恒为死条件（外层 err 恒 nil）","insight":"修复：显式捕获 statErr，使防御检查生效（stat 权限错误现在立即返回，不再静默吞掉后走 WriteFile 失败）。顺带基准扩展第 4 维度 govet nilness+unusedwrite（文档化，survey 过 fatcontext/containedctx/unparam/gocritic+29 检查：unparam 有 6+ 处真实死结果但需签名改动，留待下轮）","next_action_hint":"下轮候选：unparam（6+ 处 always-nil/never-used 结果，含 getSQLiteOverview/getPostgresOverview/getStatus 等，需改签名+调用方，churn 中等但都是真实死代码）；或 fatcontext/containedctx（3+3 处，需逐处判断是否真反模式）"}}
{"run":16,"commit":"c85373f","metric":8,"metrics":{"golint_canonicalheader":0,"golint_errname":0,"golint_errorlint":1,"golint_exhaustive":0,"golint_forcetypeassert":0,"golint_gosec":0,"golint_intrange":0,"golint_modernize":3,"golint_nilnil":3,"golint_perfsprint":0,"golint_prealloc":0,"golint_recvcheck":1,"golint_usestdlibvars":0,"golint_wastedassign":0,"golint_total":8,"golint_test_testifylint":0,"golint_test_thelper":0,"golint_test_usetesting":0,"golint_test_total":0,"golint_vetx_total":0,"eslint_problems":0,"eslint_errors":0,"eslint_warnings":0,"tsc_errors":0,"measure_s":43},"status":"keep","description":"unparam 死代码清理 12→2（保留 2 处 objectstore 构造函数统一签名）：移除 10 处恒 nil error / 从未使用的结果（getPoWConfigForRoute 的恒 nil *PoWConfig、getSQLiteOverview/getPostgresOverview/getStatus/loadKumaConfig/filterExpectedRoutes 的恒 nil error、rawJSONString/parsePositiveInt 的弃用 bool、buildProxyRoute 的弃用 []ZoneDomain、getLocked 的恒 nil error），同步简化 12+ 处调用方与死错误检查。9 个受影响包测试通过。metric 持平 8（改进在基准之外）。","timestamp":1786876191447,"segment":0,"confidence":5.128205128205129,"asi":{"hypothesis":"unparam 死代码清理：10 处 always-nil error / never-used 结果从签名移除","insight":"移除后调用方同步简化（db_manage 的 err 检查、option routers 的 AbortBadRequestOnError 成为死代码一并删）。getPoWConfigForRoute 的 *PoWConfig 结果恒 nil 且从未被用 —— 真死代码。保留 2 处 objectstore 构造函数 (X, error)：factory switch 统一签名（newS3Backend/newLocalBackend 等可能真实报错），unparam 在此为接口一致性误报。全部 9 个受影响包测试通过。metric 持平 8（改进在基准之外，诚实记录）","next_action_hint":"下一候选：fatcontext(3 处嵌套 context 闭包，多为 slog/otel ctx 传递，需逐处判断是否真反模式) 或 containedctx(3 处 struct 含 ctx 字段，含 webdav/uptimekuma client —— 重构风险中等)；或收尾把 unparam 加入基准（2 处已知保留）"}}
{"run":17,"commit":"a16be01","metric":8,"metrics":{"golint_canonicalheader":0,"golint_errname":0,"golint_errorlint":1,"golint_exhaustive":0,"golint_forcetypeassert":0,"golint_gosec":0,"golint_intrange":0,"golint_modernize":3,"golint_nilnil":3,"golint_perfsprint":0,"golint_prealloc":0,"golint_recvcheck":1,"golint_usestdlibvars":0,"golint_wastedassign":0,"golint_total":8,"golint_test_testifylint":0,"golint_test_thelper":0,"golint_test_usetesting":0,"golint_test_total":0,"golint_vetx_total":0,"eslint_problems":0,"eslint_errors":0,"eslint_warnings":0,"tsc_errors":0,"measure_s":40},"status":"keep","description":"修复 frpc 进程生命周期真 bug（agent 生产代码）：exec.CommandContext 默认只杀直接子进程，被杀 shell 的孤儿 sleep 继续持有 stderr 管道，cmd.Wait() 阻塞到其自然退出（Stop/重启可挂起秒级）。改 Setpgid 进程组 + Kill(-pid) 整组击杀。连带修复两个测试 bug（Manager 拥有 Cmd 的并发 Wait 竞态 → Signal(0) 探测；ssl_renew 用 miniredis 替代 init() 创建的真实 redis 客户端）。go test ./internal/... ./pkg/... 全绿，checks.sh 升级为真实测试门禁。","timestamp":1786877266517,"segment":0,"confidence":7.142857142857143,"asi":{"hypothesis":"frpc 进程生命周期真 bug：exec.CommandContext 只杀直接子进程，孤儿孙进程持有 stderr 管道导致 cmd.Wait 阻塞到其自然退出（实测脚本 sleep 5 时 Stop 挂起 5s）","insight":"修复：Setpgid 独立进程组 + cmd.Cancel 覆盖为 Kill(-pid,SIGKILL) 整组击杀（经隔离复现 + 临时插桩定位，4 次假设检验收敛）。连带修复两个测试 bug：TestStopCancelsRunningProcesses 对 Manager 拥有的 Cmd 并发 Wait（与 os/exec ctxResult 通道竞争永久挂起）改为 Signal(0) 探测；ssl_renew 测试改用 miniredis（task 包 init() 创建真实 redis 客户端，违反 repo 无 init 装配约束）。成果：go test ./internal/... ./pkg/... 从 3 个失败→全绿（81+13 包），checks.sh 升级为真实测试门禁。metric 持平 8（改进在基准之外，但价值最高的一轮）","next_action_hint":"测试全绿后可解锁：paralleltest/tparallel 维度（t.Parallel 提速）——需先评估共享状态（miniredis/sqlite 每测试独立，风险低）；或探索 relay/frps 同构代码是否有同样的 group-kill 问题（frps/manager 结构相同，值得检查）"}}
