{"run":18,"commit":"f5c9da0","metric":8,"metrics":{"golint_canonicalheader":0,"golint_errname":0,"golint_errorlint":1,"golint_exhaustive":0,"golint_forcetypeassert":0,"golint_gosec":0,"golint_intrange":0,"golint_modernize":3,"golint_nilnil":3,"golint_perfsprint":0,"golint_prealloc":0,"golint_recvcheck":1,"golint_usestdlibvars":0,"golint_wastedassign":0,"golint_total":8,"golint_test_testifylint":0,"golint_test_thelper":0,"golint_test_usetesting":0,"golint_test_total":0,"golint_vetx_total":0,"eslint_problems":0,"eslint_errors":0,"eslint_warnings":0,"tsc_errors":0,"measure_s":39},"status":"keep","description":"前端测试套件 44 失败→全绿：10 个测试文件补 NextIntlClientProvider 包装（含 React19 createElement 类型修复、.ts→.tsx 重命名）；修复真实 i18n ICU bug（githubUrlInvalid 的 {owner}/{repo} 未转义导致生产渲染成 key，zh/en + fragment 4 文件同步转义）；更新 2 处过期测试期望。vitest 116/116 + tsc + eslint 全绿，checks.sh 增加前端测试门禁。","timestamp":1786878501539,"segment":0,"confidence":9.523809523809524,"asi":{"hypothesis":"前端测试可运行性：next-intl 迁移后 44/116 测试失败（缺 NextIntlClientProvider + 3 处真实断言问题）","insight":"修复三类：(1) 10 个测试文件的 render 助手缺 NextIntlClientProvider（createElement 与 JSX 混用踩 React19 类型坑，.ts 文件不能写 JSX → 重命名为 .tsx）；(2) 真实 i18n bug：githubUrlInvalid 消息的 {owner}/{repo} 被 ICU 当占位符，t() 无参调用渲染成 key —— 需 '{' 单引号转义（'{}' 内层转义不够，必须整体引号包裹 '{owner}'），4 个消息文件（zh/en + fragment 源）同步修复，check:i18n 通过；(3) 2 处测试期望过期（唯一访问者→查询窗口独立访客、检查间隔→检查间隔（分钟），以消息文件为准）。成果：116/116 vitest + tsc/eslint 全绿，checks.sh 增加前端测试门禁","next_action_hint":"前端测试全绿后可把 vitest 失败数纳入基准（当前不在基准内）；或检查 app/(main) 目录下 3 个自带 .test.tsx（waf editor 系列）是否也符合新约定"}}
{"run":19,"commit":"c455be3","metric":8,"metrics":{"golint_canonicalheader":0,"golint_errname":0,"golint_errorlint":1,"golint_exhaustive":0,"golint_forcetypeassert":0,"golint_gosec":0,"golint_intrange":0,"golint_modernize":3,"golint_nilnil":3,"golint_perfsprint":0,"golint_prealloc":0,"golint_recvcheck":1,"golint_usestdlibvars":0,"golint_wastedassign":0,"golint_total":8,"golint_test_testifylint":0,"golint_test_thelper":0,"golint_test_usetesting":0,"golint_test_total":0,"golint_vetx_total":0,"eslint_problems":0,"eslint_errors":0,"eslint_warnings":0,"tsc_errors":0,"vitest_failed":0,"vitest_total":116,"measure_s":62},"status":"keep","description":"基准扩展第 5 维度（文档化）：前端 vitest 失败数纳入 total_issues（vitest_failed=0, total=116）。5 维全部处于下限，total=8 不变。","timestamp":1786878719509,"segment":0,"confidence":14.285714285714286,"asi":{"hypothesis":"基准扩展第 5 维度：前端 vitest 失败数（全绿后纳入防回归，文档化范围扩展非作弊）","insight":"measure_s 从 39s 升到 62s（vitest ~20s + eslint 冷启动），可接受。5 个维度全部在其下限：生产 8（全刻意保留）+ 测试 0 + govet 0 + eslint/tsc 0 + vitest 0","next_action_hint":"基准已 5 维全下限。后续可深化：paralleltest（现在测试可跑，但共享全局状态风险仍在，低优先）；或 frontend biome 格式一次性提交（不进基准）；或前端组件更深规则（jsx-a11y 已在 next core-web-vitals 覆盖）。也可认为会话到达稳定收尾点，更新 prompt/ideas 后总结"}}
{"run":20,"commit":"4962bf9","metric":8,"metrics":{"golint_canonicalheader":0,"golint_errname":0,"golint_errorlint":1,"golint_exhaustive":0,"golint_forcetypeassert":0,"golint_gosec":0,"golint_intrange":0,"golint_modernize":3,"golint_nilnil":3,"golint_perfsprint":0,"golint_prealloc":0,"golint_recvcheck":1,"golint_usestdlibvars":0,"golint_wastedassign":0,"golint_total":8,"golint_test_testifylint":0,"golint_test_thelper":0,"golint_test_usetesting":0,"golint_test_total":0,"golint_vetx_total":0,"eslint_problems":0,"eslint_errors":0,"eslint_warnings":0,"tsc_errors":0,"vitest_failed":0,"vitest_total":116,"measure_s":86},"status":"keep","description":"两处真实质量修复：(1) 过期 swagger 文档重新生成（status_2xx/4xx/5xx_count 字段随 a4dd5ca9 加入后未同步 docs，违反 repo 约定，swag init 后差异仅真实新增字段）；(2) generate-themes.js 输出补尾换行，themes.json 构建可复现（此前每次 build 弄脏工作树）。验证 next build 成功、musttag/tagalign 调查无真实问题。","timestamp":1786879144888,"segment":0,"confidence":25,"asi":{"hypothesis":"验证生产构建 + 修两处真实质量问题：swagger 文档过期（status_2xx/4xx/5xx_count 新增字段未重新生成）与 themes.json 构建不可复现（generate-themes.js 缺尾换行，每次 build 弄脏工作树）","insight":"next build 成功（无构建问题）；musttag 3 处与 tagalign 均判定为非问题（持久化 round-trip 自洽/调试日志/纯格式）。swagger 差异仅 27 行且全部真实（a4dd5ca9 状态码拆分字段）。generate-themes.js 补 '\\n' 后 themes.json 再生与提交版完全一致，构建可复现。metric 持平 8（改进在基准之外）","next_action_hint":"会话已 5 维全下限 + 构建可复现 + 双端测试全绿。收尾候选：更新 prompt/ideas 记录本轮成果后总结；或继续验证 swag 生成的 docs.go 在 CI 中的可复现性"}}
{"run":21,"commit":"e1b439d","metric":8,"metrics":{"golint_canonicalheader":0,"golint_errname":0,"golint_errorlint":1,"golint_exhaustive":0,"golint_forcetypeassert":0,"golint_gosec":0,"golint_intrange":0,"golint_modernize":3,"golint_nilnil":3,"golint_perfsprint":0,"golint_prealloc":0,"golint_recvcheck":1,"golint_usestdlibvars":0,"golint_wastedassign":0,"golint_total":8,"golint_test_testifylint":0,"golint_test_thelper":0,"golint_test_usetesting":0,"golint_test_total":0,"golint_vetx_total":0,"eslint_problems":0,"eslint_errors":0,"eslint_warnings":0,"tsc_errors":0,"vitest_failed":0,"vitest_total":116,"measure_s":74},"status":"keep","description":"全仓 go test -race 扫描（93 包）→ 全绿。修复 6 类数据竞争：frpc/frps 测试的锁外读与并发 Wait；oauth/repository 4 个 Pub/Sub 监听器 goroutine 读可变包变量（局部捕获 + done 通道等待）；oauth 测试换 db.Redis 前停监听器；【真实生产 bug】tls 响应快照与异步续签 goroutine 并发写 cert 竞争（先快照再起 goroutine）；upload/cache 监听器 goroutine 内读 db.Redis（调用方捕获）。","timestamp":1786881379399,"segment":0,"confidence":100,"asi":{"hypothesis":"全仓 -race 扫描：发现并修复 6 类数据竞争，含 1 个真实生产竞争","insight":"修复清单：(1) frpc 测试助手锁外读 proc.Status；(2) frps 测试对 Manager 拥有的 Cmd 并发 Wait（与 frpc 同类）；(3) oauth/repository 4 个 Pub/Sub 监听器 goroutine 内读可变包变量 userListenerCtx 等 → 局部捕获 + stop 增加 done 通道等待；(4) oauth 测试 setupTestRouter 换 db.Redis 前先停各层监听器；(5)【真实生产 bug】tls logics 的 sanitizeCertificateForResponse 整体拷贝 cert 与异步续签 goroutine 字段写入并发 → 先快照再起 goroutine；(6) upload/cache 监听器 goroutine 内读 db.Redis → 调用方捕获。成果：93 包 go test -race 全绿。基准 5 维全下限不变（改进在基准外，但 tls 竞争是生产级真实问题）","next_action_hint":"可考虑把 -race 纳入周期性验证（不进每次 checks，全仓 ~3 分钟）；或在 prompt/ideas 记录本轮成果"}}
{"run":22,"commit":"ab70633","metric":8,"metrics":{"golint_canonicalheader":0,"golint_errname":0,"golint_errorlint":1,"golint_exhaustive":0,"golint_forcetypeassert":0,"golint_gosec":0,"golint_intrange":0,"golint_modernize":3,"golint_nilnil":3,"golint_perfsprint":0,"golint_prealloc":0,"golint_recvcheck":1,"golint_usestdlibvars":0,"golint_wastedassign":0,"golint_total":8,"golint_test_testifylint":0,"golint_test_thelper":0,"golint_test_usetesting":0,"golint_test_total":0,"golint_vetx_total":0,"eslint_problems":0,"eslint_errors":0,"eslint_warnings":0,"tsc_errors":0,"vitest_failed":0,"vitest_total":116,"measure_s":68},"status":"keep","description":"checks.sh 新增并发密集包 -race 门禁（8 个快速包，全仓 -race 清零后纳入防回归；frpc/frps 慢套件留作周期全量验证）。核查 7 处 t.Skip 均为合法环境门控。","timestamp":1786881700477,"segment":0,"confidence":200,"asi":{"hypothesis":"把 -race 门禁纳入 checks.sh（并发密集包子集，全仓 -race 清零后防回归）","insight":"选 8 个快速并发包（oauth/tls/uptimekuma/upload-cache/repository/disk-cache/logger/batchwriter，约 20s），排除 frpc/frps 慢套件（15s backoff + 25s supervisor，另做周期全量验证）。checks 总耗时 ~60s 可接受。顺带核查 7 处 t.Skip 均为合法环境门控（PG/CH 集成、symlink 平台差异），无隐藏损坏。metric 持平 8","next_action_hint":"会话已达全面收敛：5 维基准全下限 + 全仓 -race 清零 + 双端测试全绿 + 构建可复现 + -race 门禁入 checks。可收尾：更新 prompt/ideas 后总结"}}
{"run":23,"commit":"aa4fadd","metric":8,"metrics":{"golint_canonicalheader":0,"golint_errname":0,"golint_errorlint":1,"golint_exhaustive":0,"golint_forcetypeassert":0,"golint_gosec":0,"golint_intrange":0,"golint_modernize":3,"golint_nilnil":3,"golint_perfsprint":0,"golint_prealloc":0,"golint_recvcheck":1,"golint_usestdlibvars":0,"golint_wastedassign":0,"golint_total":8,"golint_test_testifylint":0,"golint_test_thelper":0,"golint_test_usetesting":0,"golint_test_total":0,"golint_vetx_total":0,"eslint_problems":0,"eslint_errors":0,"eslint_warnings":0,"tsc_errors":0,"vitest_failed":0,"vitest_total":116,"measure_s":81},"status":"keep","description":"补齐 131 个 .go 文件的 SPDX license 头（repo 自带 make license 约定，早于约定新增的文件含 2 个生产文件；纯注释插入零行为影响），make license-check 转绿。go mod tidy -diff 确认干净。","timestamp":1786882164158,"segment":0,"confidence":null,"asi":{"hypothesis":"跑 repo 自带门禁 make license-check：发现 131 个 .go 文件缺 SPDX 头（早于 license 约定，含 2 个生产文件与多份本会话早期改过的文件）","insight":"用 repo 自带 scripts/update_go_license.sh（make license）自动补头（391 行纯注释插入），license-check 转绿；go mod tidy -diff 干净。gofmt/build/全测试/-race 均通过。metric 持平 8","next_action_hint":"会话全维度收敛。收尾：把 license-check 加入 checks.sh 防再犯；更新 prompt/ideas 最终状态"}}
{"run":24,"commit":"4d78bc1","metric":8,"metrics":{"golint_canonicalheader":0,"golint_errname":0,"golint_errorlint":1,"golint_exhaustive":0,"golint_forcetypeassert":0,"golint_gosec":0,"golint_intrange":0,"golint_modernize":3,"golint_nilnil":3,"golint_perfsprint":0,"golint_prealloc":0,"golint_recvcheck":1,"golint_usestdlibvars":0,"golint_wastedassign":0,"golint_total":8,"golint_test_testifylint":0,"golint_test_thelper":0,"golint_test_usetesting":0,"golint_test_total":0,"golint_vetx_total":0,"eslint_problems":0,"eslint_errors":0,"eslint_warnings":0,"tsc_errors":0,"vitest_failed":0,"vitest_total":116,"measure_s":83},"status":"keep","description":"收敛验证轮：3× 时序敏感包测试无 flake；config.example.yaml ↔ model.go 同步确认无漂移（scheduler 空结构、replicas 注释化、queues[].name 嵌套均为误报）；make build-embedded 发布路径构建成功且工作树干净（bin/、frontend/out 已 gitignore）。更新 prompt/ideas 记录会话终态。metric 持平 8。","timestamp":1786882694298,"segment":0,"confidence":null,"asi":{"hypothesis":"会话收敛验证：跑 3× 时序敏感包（无 flake）、config.example.yaml↔model.go 同步（3 个疑似缺失均为误报：scheduler 空结构/replicas 注释化/queues[].name 嵌套）、make build-embedded 发布路径（成功且树干净）","insight":"全部为确认性结果，无新问题。诚实记录：本轮零代码改动（上一轮已修 license），metric 持平 8。会话正式收敛：基准 5 维全下限 + 全仓 -race 清零 + 双端测试全绿 + 发布可复现 + config/文档同步。prompt/ideas 已更新终态","next_action_hint":"会话已收敛。若继续：周期全量 -race、前端 axe 浏览器级 a11y 审计（ideas.md 已记录）"}}
{"run":25,"commit":"7f8e257","metric":8,"metrics":{"golint_canonicalheader":0,"golint_errname":0,"golint_errorlint":1,"golint_exhaustive":0,"golint_forcetypeassert":0,"golint_gosec":0,"golint_intrange":0,"golint_modernize":3,"golint_nilnil":3,"golint_perfsprint":0,"golint_prealloc":0,"golint_recvcheck":1,"golint_usestdlibvars":0,"golint_wastedassign":0,"golint_total":8,"golint_test_testifylint":0,"golint_test_thelper":0,"golint_test_usetesting":0,"golint_test_total":0,"golint_vetx_total":0,"eslint_problems":0,"eslint_errors":0,"eslint_warnings":0,"tsc_errors":0,"vitest_failed":0,"vitest_total":118,"measure_s":71},"status":"keep","description":"前端真实 a11y 审计：新增 axe-core（devDep）+ tests/a11y.test.tsx，对登录页与注册页渲染完整表单后运行 axe 结构性规则（label/button-name/heading-order/landmark/aria），两页均零违规。摸清并处理了渲染依赖（UserProvider 会话检查、publicConfigQuery 门控、configBool 字符串语义）。vitest 116→118 全绿。","timestamp":1786884595141,"segment":0,"confidence":null,"asi":{"hypothesis":"前端真实 a11y 审计：axe-core（jsdom 结构性规则）覆盖登录/注册页，超出 eslint 静态 jsx-a11y 的动态可访问性验证","insight":"新增 tests/a11y.test.tsx（2 测试）+ axe-core devDependency。调试中摸清登录/注册页渲染依赖链（UserProvider 挂载跳查 getUserInfo、LoginForm/RegisterForm 门控 publicConfigQuery、configBool 期望字符串 'true' 而非布尔 —— mock 需给字符串）。两页均零 axe 违规（color-contrast 因 jsdom 无布局引擎禁用，文档化）。vitest 116→118，checks 全绿。metric 持平 8","next_action_hint":"可扩展 axe 到更多页面（如登录 OTP 态、设置页），或收尾。axe 依赖仅 devDependency，不进基准计数（vitest_failed 已含新测试）"}}
{"run":26,"commit":"7d03154","metric":8,"metrics":{"golint_canonicalheader":0,"golint_errname":0,"golint_errorlint":1,"golint_exhaustive":0,"golint_forcetypeassert":0,"golint_gosec":0,"golint_intrange":0,"golint_modernize":3,"golint_nilnil":3,"golint_perfsprint":0,"golint_prealloc":0,"golint_recvcheck":1,"golint_usestdlibvars":0,"golint_wastedassign":0,"golint_total":8,"golint_test_testifylint":0,"golint_test_thelper":0,"golint_test_usetesting":0,"golint_test_total":0,"golint_vetx_total":0,"eslint_problems":0,"eslint_errors":0,"eslint_warnings":0,"tsc_errors":0,"vitest_failed":0,"vitest_total":120,"measure_s":71},"status":"keep","description":"axe a11y 审计扩展到登录 OTP 验证表单（input-otp 分段输入，FieldLabel htmlFor 正确关联，零违规）与人机验证小部件手动模式（零违规）。环境修复：tests/setup.ts 加 ResizeObserver mock（input-otp 依赖，jsdom 未内置）。vitest 118→120 全绿。","timestamp":1786885103995,"segment":0,"confidence":null,"asi":{"hypothesis":"把 axe a11y 审计扩展到登录/注册外的关键表单状态：登录 OTP 验证（input-otp 分段输入是经典 a11y 雷区）与人机验证小部件（CapWidget 手动模式）","insight":"新增 2 个 axe 测试（vitest 118→120）。OTPForm 验证通过 —— FieldLabel htmlFor='otp-verification' 与 InputOTP id 正确关联，分段输入零违规；CapWidget 手动模式零违规。环境修复：input-otp 依赖 ResizeObserver，jsdom 未内置 → tests/setup.ts 加 ResizeObserver mock（全局，其它测试无害）。渲染上下文修正：裸组件需 <main> landmark 包裹（region 规则，真实页面由 AuthShell 提供）。scripts/ Go 代码用扩展 linter 集扫描为 0 问题（死路，未纳入基准）。metric 持平 8","next_action_hint":"a11y 覆盖已达：登录/注册页/OTP/CapWidget 全零违规。剩余页面（设置页、admin）需较重 mock。会话可收尾，或周期跑全量 -race 验证无 flake"}}
{"run":27,"commit":"6c128e0","metric":8,"metrics":{"golint_canonicalheader":0,"golint_errname":0,"golint_errorlint":1,"golint_exhaustive":0,"golint_forcetypeassert":0,"golint_gosec":0,"golint_intrange":0,"golint_modernize":3,"golint_nilnil":3,"golint_perfsprint":0,"golint_prealloc":0,"golint_recvcheck":1,"golint_usestdlibvars":0,"golint_wastedassign":0,"golint_total":8,"golint_test_testifylint":0,"golint_test_thelper":0,"golint_test_usetesting":0,"golint_test_total":0,"golint_vetx_total":0,"eslint_problems":0,"eslint_errors":0,"eslint_warnings":0,"tsc_errors":0,"vitest_failed":0,"vitest_total":121,"measure_s":71},"status":"keep","description":"axe a11y 审计扩展到最复杂认证路径：注册页开启人机验证（CapWidget 自动求解→已通过状态 + 完整表单），mock getCapToken 避免 jsdom 无 Worker 环境限制。零违规。vitest 120→121 全绿。","timestamp":1786885536618,"segment":0,"confidence":null,"asi":{"hypothesis":"axe 审计覆盖最复杂的认证渲染路径：注册页开启人机验证（CapWidget 自动求解→已通过状态 + 完整表单）","insight":"新增第 5 个 axe 测试（vitest 120→121）：mock @/lib/cap-solver 的 getCapToken 直接 resolve token（避免 jsdom 无 Web Worker），config 开 cap_login_enabled/cap_auto_solve，注册页渲染出 CAPTCHA 已通过态 + 表单全字段 → 零违规。vi.mock('@/lib/cap-solver') 对其它测试无害（仅 capEnabled 时渲染 CapWidget）。metric 持平 8","next_action_hint":"axe 覆盖已达 5 个认证表单态（登录/注册/OTP/验证小部件手动/注册+验证）。剩余：设置页与 admin 页需较重 mock。可收尾，或周期跑全量 -race 验证无 flake"}}
{"run":28,"commit":"40eee77","metric":8,"metrics":{"golint_canonicalheader":0,"golint_errname":0,"golint_errorlint":1,"golint_exhaustive":0,"golint_forcetypeassert":0,"golint_gosec":0,"golint_intrange":0,"golint_modernize":3,"golint_nilnil":3,"golint_perfsprint":0,"golint_prealloc":0,"golint_recvcheck":1,"golint_usestdlibvars":0,"golint_wastedassign":0,"golint_total":8,"golint_test_testifylint":0,"golint_test_thelper":0,"golint_test_usetesting":0,"golint_test_total":0,"golint_vetx_total":0,"eslint_problems":0,"eslint_errors":0,"eslint_warnings":0,"tsc_errors":0,"vitest_failed":0,"vitest_total":121,"measure_s":0},"status":"keep","description":"前端显式 any 类型清理 2→0：Slot children?: any → ReactNode | MotionValue 联合（motion 真实类型），顺带修复潜在崩溃（原代码在 isValidElement 前访问 children.type，缺失时 TypeError，现无效 children 返回 null，hooks 无条件合规）；useControlledState Rest extends any[] → unknown[]。两处 eslint-disable 注释删除。tsc/eslint/vitest 121 全绿。","timestamp":1786886086713,"segment":0,"confidence":null,"asi":{"hypothesis":"前端显式 any 类型清理：全仓 grep 仅 2 处 any —— Slot children?: any 与 useControlledState 的 Rest extends any[]，均为真实类型缺陷","insight":"全前端 any 计数 2→0。slot.tsx：children?: any → React.ReactNode | MotionValue<string> | MotionValue<number>（motion HTMLMotionProps 的真实 children 类型）；顺带修复潜在崩溃 —— 原代码在 isValidElement 检查前就访问 children.type，children 缺失时 TypeError，改为 isValidChild/childrenType 先计算（hooks 无条件，rules-of-hooks 合规），无效 children 返回 null。use-controlled-state.tsx：Rest extends any[] → unknown[]。两处 eslint-disable no-explicit-any 注释随之删除（无抑制注释）。tsc/eslint/vitest 121/checks.sh 全绿。benchmark 无关（metric 持平 8）。注意：run #28 的 run_experiment 被用户中断（aborted），但代码修复已通过全部门禁验证","next_action_hint":"用户要求合并到 main 并推送"}}
{"run":29,"commit":"511bed8","metric":8,"metrics":{"golint_canonicalheader":0,"golint_errname":0,"golint_errorlint":1,"golint_forcetypeassert":0,"golint_gosec":0,"golint_intrange":0,"golint_modernize":3,"golint_nilnil":3,"golint_perfsprint":0,"golint_prealloc":0,"golint_recvcheck":1,"golint_usestdlibvars":0,"golint_wastedassign":0,"golint_total":8,"eslint_problems":0,"eslint_errors":0,"eslint_warnings":0,"tsc_errors":0,"measure_s":63,"golint_test_testifylint":0,"golint_test_thelper":0,"golint_test_usetesting":0,"golint_test_total":0,"golint_exhaustive":0,"golint_vetx_total":0,"vitest_failed":0,"vitest_total":124},"status":"keep","description":"修复 2 个新增 unconvert 问题（linux.go 中 int64(stat.Bsize) 恒等转换，Statfs_t.Bsize 在 Linux 上本就是 int64），删除多余转换零行为变化；total 10→8 回到 5 维全下限。","timestamp":1786894372432,"segment":0,"confidence":null,"asi":{"category":"unconvert","hypothesis":"会话恢复后 measure 显示 total=10，出现 2 个新的 unconvert 问题（internal/apps/edge/observability/linux.go:261-262 的 int64(stat.Bsize) 恒等转换，Linux Statfs_t.Bsize 本就是 int64）。删除多余转换，零行为变化","finding":"unconvert 是 repo 自带配置启用的 linter，此前 baseline 无此问题，最近用户提交/Go 版本变化后新增；修复后 5 维回到全下限 8","next_action_hint":"会话恢复点确认：total=8（5 维全下限，8 项均为有据可查的刻意保留）。下一轮候选：静态检查新维度（staticcheck SA 系列在 repo 配置中已启用且为 0）、或把 docs/ 下 vitepress 站点的构建纳入 measure 防回归（docs build 不属质量计数，不进基准）"}}
{"run":30,"commit":"d49c7e1","metric":8,"metrics":{"golint_canonicalheader":0,"golint_errname":0,"golint_errorlint":1,"golint_forcetypeassert":0,"golint_gosec":0,"golint_intrange":0,"golint_modernize":3,"golint_nilnil":3,"golint_perfsprint":0,"golint_prealloc":0,"golint_recvcheck":1,"golint_usestdlibvars":0,"golint_wastedassign":0,"golint_total":8,"eslint_problems":0,"eslint_errors":0,"eslint_warnings":0,"tsc_errors":0,"measure_s":183,"golint_test_testifylint":0,"golint_test_thelper":0,"golint_test_usetesting":0,"golint_test_total":0,"golint_exhaustive":0,"golint_vetx_total":0,"vitest_failed":0,"vitest_total":126},"status":"checks_failed","description":"Agent 发现 Token 比较改为 SHA-256 后恒定时间 Compare，堵住未授权节点注册口的计时侧信道。checks 在 -race 阶段超时（包本身已单独跑绿）。","timestamp":1787667218065,"segment":0,"confidence":null,"asi":{"hypothesis":"discovery token 用 != 比较，未授权 /agent/nodes/register 可被计时；改 SHA-256 + ConstantTimeCompare","rollback_reason":"checks.sh 在 go test -race 阶段 300s 超时（包单独跑全绿，预算不够）","next_action_hint":"同一修复用 checks_timeout_seconds=600 重跑"}}
{"run":31,"commit":"69055a9","metric":8,"metrics":{"golint_canonicalheader":0,"golint_errname":0,"golint_errorlint":1,"golint_forcetypeassert":0,"golint_gosec":0,"golint_intrange":0,"golint_modernize":3,"golint_nilnil":3,"golint_perfsprint":0,"golint_prealloc":0,"golint_recvcheck":1,"golint_usestdlibvars":0,"golint_wastedassign":0,"golint_total":8,"eslint_problems":0,"eslint_errors":0,"eslint_warnings":0,"tsc_errors":0,"measure_s":71,"golint_test_testifylint":0,"golint_test_thelper":0,"golint_test_usetesting":0,"golint_test_total":0,"golint_exhaustive":0,"golint_vetx_total":0,"vitest_failed":0,"vitest_total":126},"status":"keep","description":"未授权 Agent 注册口的 discovery token 改为 SHA-256 后恒定时间比较，堵住计时侧信道；空 token / 末字节翻转用例同步补上。metric 持平 8。","timestamp":1787667401636,"segment":0,"confidence":null,"asi":{"hypothesis":"discovery token 用 != 比较，未授权 /agent/nodes/register 可被计时；改 SHA-256 + ConstantTimeCompare","finding":"公开面注册口 ValidateDiscoveryToken 是入侵入口；管理员已登录操作不在范围内。checks 全绿。","next_action_hint":"下一轮可查边缘 Token 比较（agent/relay/flared 走 DB 查找，计时面更弱）或登录口限流"}}
{"run":32,"commit":"fb62802","metric":8,"metrics":{"golint_canonicalheader":0,"golint_errname":0,"golint_errorlint":1,"golint_forcetypeassert":0,"golint_gosec":0,"golint_intrange":0,"golint_modernize":3,"golint_nilnil":3,"golint_perfsprint":0,"golint_prealloc":0,"golint_recvcheck":1,"golint_usestdlibvars":0,"golint_wastedassign":0,"golint_total":8,"eslint_problems":0,"eslint_errors":0,"eslint_warnings":0,"tsc_errors":0,"measure_s":81,"golint_test_testifylint":0,"golint_test_thelper":0,"golint_test_usetesting":0,"golint_test_total":0,"golint_exhaustive":0,"golint_vetx_total":0,"vitest_failed":0,"vitest_total":126},"status":"keep","description":"公开登录/注册邮箱验证码比较改为 SHA-256 后恒定时间 Compare，堵住未授权口的计时侧信道。metric 持平 8。","timestamp":1787667660993,"segment":0,"confidence":null,"asi":{"hypothesis":"verifyEmailCode 用 != 比较 6 位码，公开登录/注册口可被计时","finding":"公开面验证码比较已改恒定时间；冷却仍在，不改限流策略。","next_action_hint":"下一轮可查边缘节点 access_token 比较（DB 查找，计时面更弱）或登录失败锁定"}}
{"run":33,"commit":"b8bf82b","metric":8,"metrics":{"golint_canonicalheader":0,"golint_errname":0,"golint_errorlint":1,"golint_forcetypeassert":0,"golint_gosec":0,"golint_intrange":0,"golint_modernize":3,"golint_nilnil":3,"golint_perfsprint":0,"golint_prealloc":0,"golint_recvcheck":1,"golint_usestdlibvars":0,"golint_wastedassign":0,"golint_total":8,"eslint_problems":0,"eslint_errors":0,"eslint_warnings":0,"tsc_errors":0,"measure_s":99,"golint_test_testifylint":0,"golint_test_thelper":0,"golint_test_usetesting":0,"golint_test_total":0,"golint_exhaustive":0,"golint_vetx_total":0,"vitest_failed":0,"vitest_total":126},"status":"keep","description":"未授权登录口补哑 bcrypt 比较，用户不存在与密码错误耗时对齐；禁用账号不再返回不同文案，堵住用户枚举。metric 持平 8。","timestamp":1787668237322,"segment":0,"confidence":null,"asi":{"hypothesis":"未授权 /user/login 在用户不存在时跳过 bcrypt，且禁用账号返回不同文案，可枚举用户","finding":"DummyCheckPassword 启动时生成哑哈希，gosec 不报警；禁用账号改统一错误文案。管理员已登录不在范围内。","next_action_hint":"下一轮可查边缘节点 access_token 明文比较，或公开 CAP challenge 滥用"}}
{"run":34,"commit":"380a42a","metric":8,"metrics":{"golint_canonicalheader":0,"golint_errname":0,"golint_errorlint":1,"golint_forcetypeassert":0,"golint_gosec":0,"golint_intrange":0,"golint_modernize":3,"golint_nilnil":3,"golint_perfsprint":0,"golint_prealloc":0,"golint_recvcheck":1,"golint_usestdlibvars":0,"golint_wastedassign":0,"golint_total":8,"eslint_problems":0,"eslint_errors":0,"eslint_warnings":0,"tsc_errors":0,"measure_s":90,"golint_test_testifylint":0,"golint_test_thelper":0,"golint_test_usetesting":0,"golint_test_total":0,"golint_exhaustive":0,"golint_vetx_total":0,"vitest_failed":0,"vitest_total":126},"status":"keep","description":"登录/注册/OAuth 回调统一走 SetLoginSession，保存前清空 Redis 会话 ID，堵住未授权会话固定。metric 持平 8。","timestamp":1787669059138,"segment":0,"confidence":null,"asi":{"hypothesis":"生产 Redis 会话在登录时复用同一 ID，未授权方可固定会话 cookie","finding":"SetLoginSession 先 Clear 再把 gorilla session.ID 置空，Save 时 redistore 生成新 ID；明文改密标记经 extras 写回。","next_action_hint":"下一轮可查边缘节点 access_token 明文比较，或公开 CAP challenge 滥用"}}
