{"run":35,"commit":"dfda2d3","metric":8,"metrics":{"golint_canonicalheader":0,"golint_errname":0,"golint_errorlint":1,"golint_forcetypeassert":0,"golint_gosec":0,"golint_intrange":0,"golint_modernize":3,"golint_nilnil":3,"golint_perfsprint":0,"golint_prealloc":0,"golint_recvcheck":1,"golint_usestdlibvars":0,"golint_wastedassign":0,"golint_total":8,"eslint_problems":0,"eslint_errors":0,"eslint_warnings":0,"tsc_errors":0,"measure_s":75,"golint_test_testifylint":0,"golint_test_thelper":0,"golint_test_usetesting":0,"golint_test_total":0,"golint_exhaustive":0,"golint_vetx_total":0,"vitest_failed":0,"vitest_total":126},"status":"keep","description":"去掉公开 CAP 口硬编码默认密钥；SessionSecret 为空时拒绝签发/核销，防止未授权伪造 PoW。metric 持平 8。","timestamp":1787669542055,"segment":0,"confidence":null,"asi":{"hypothesis":"公开 /api/cap/challenge 在 SessionSecret 为空时用硬编码默认密钥，未授权方可伪造 PoW","finding":"GetDefaultManager 无密钥时返回 nil；Challenge/Redeem 拒绝，VerifyMiddleware 在 CAP 开启时同样拒绝。测试自行设置密钥。","next_action_hint":"下一轮可查公开 OAuth state 洪水或边缘节点 access_token 明文比较"}}
{"run":36,"commit":"7fa9e46","metric":8,"metrics":{"golint_canonicalheader":0,"golint_errname":0,"golint_errorlint":1,"golint_forcetypeassert":0,"golint_gosec":0,"golint_intrange":0,"golint_modernize":3,"golint_nilnil":3,"golint_perfsprint":0,"golint_prealloc":0,"golint_recvcheck":1,"golint_usestdlibvars":0,"golint_wastedassign":0,"golint_total":8,"eslint_problems":0,"eslint_errors":0,"eslint_warnings":0,"tsc_errors":0,"measure_s":86,"golint_test_testifylint":0,"golint_test_thelper":0,"golint_test_usetesting":0,"golint_test_total":0,"golint_exhaustive":0,"golint_vetx_total":0,"vitest_failed":0,"vitest_total":126},"status":"keep","description":"注册开关读取失败时改为关闭，堵住配置缺失时未授权开注册；OAuth 自动注册同样 fail-closed。metric 持平 8。","timestamp":1787669960693,"segment":0,"confidence":null,"asi":{"hypothesis":"registration_enabled/password_register_enabled 读取失败默认 true，和种子 false 相反，配置缺失时未授权开注册","finding":"密码注册与 OAuth 自动注册均 fail-closed；测试改为显式开启注册并正确失效缓存。","next_action_hint":"下一轮可查 OIDC 开关 fail-open（种子默认 true，风险较低）或公开 OAuth state 洪水"}}
{"run":37,"commit":"0290c93","metric":8,"metrics":{"golint_canonicalheader":0,"golint_errname":0,"golint_errorlint":1,"golint_forcetypeassert":0,"golint_gosec":0,"golint_intrange":0,"golint_modernize":3,"golint_nilnil":3,"golint_perfsprint":0,"golint_prealloc":0,"golint_recvcheck":1,"golint_usestdlibvars":0,"golint_wastedassign":0,"golint_total":8,"eslint_problems":0,"eslint_errors":0,"eslint_warnings":0,"tsc_errors":0,"measure_s":95,"golint_test_testifylint":0,"golint_test_thelper":0,"golint_test_usetesting":0,"golint_test_total":0,"golint_exhaustive":0,"golint_vetx_total":0,"vitest_failed":0,"vitest_total":126},"status":"keep","description":"公开 OAuth 登录/授权入口按会话限制 10 分钟内最多 20 个 state，堵住未授权 Redis 洪水。metric 持平 8。","timestamp":1787670327304,"segment":0,"confidence":null,"asi":{"hypothesis":"公开 /oauth/login 与 /oauth/{source}/authorize 每次请求都往 Redis 写 10 分钟 state，无上限","finding":"按 sessionHash 计数，10 分钟内最多 20 个；超出返回业务错误。mock Redis 补 Incr/Expire。","next_action_hint":"下一轮可查边缘节点 access_token 明文比较，或公开 CAP challenge 洪水"}}
{"run":38,"commit":"c0a82f8","metric":8,"metrics":{"golint_canonicalheader":0,"golint_errname":0,"golint_errorlint":1,"golint_forcetypeassert":0,"golint_gosec":0,"golint_intrange":0,"golint_modernize":3,"golint_nilnil":3,"golint_perfsprint":0,"golint_prealloc":0,"golint_recvcheck":1,"golint_usestdlibvars":0,"golint_wastedassign":0,"golint_total":8,"eslint_problems":0,"eslint_errors":0,"eslint_warnings":0,"tsc_errors":0,"measure_s":85,"golint_test_testifylint":0,"golint_test_thelper":0,"golint_test_usetesting":0,"golint_test_total":0,"golint_exhaustive":0,"golint_vetx_total":0,"vitest_failed":0,"vitest_total":126},"status":"keep","description":"公开密码登录口按 IP 限制 10 分钟内最多 20 次失败，堵住未授权爆破。metric 持平 8。","timestamp":1787670665553,"segment":0,"confidence":null,"asi":{"hypothesis":"公开 /user/login 失败无 IP 限流，未授权方可无限爆破","finding":"按 ClientIP 计数，10 分钟 20 次失败后拒绝；成功清零。管理员已登录不在范围内。","next_action_hint":"下一轮可查公开 CAP challenge 洪水或边缘节点 access_token 明文比较"}}
{"run":39,"commit":"be5d067","metric":8,"metrics":{"eslint_errors":0,"eslint_problems":0,"eslint_warnings":0,"golint_canonicalheader":0,"golint_errname":0,"golint_errorlint":1,"golint_exhaustive":0,"golint_forcetypeassert":0,"golint_gosec":0,"golint_intrange":0,"golint_modernize":3,"golint_nilnil":3,"golint_perfsprint":0,"golint_prealloc":0,"golint_recvcheck":1,"golint_test_testifylint":0,"golint_test_thelper":0,"golint_test_total":0,"golint_test_usetesting":0,"golint_total":8,"golint_usestdlibvars":0,"golint_vetx_total":0,"golint_wastedassign":0,"measure_s":76,"tsc_errors":0,"vitest_failed":0,"vitest_total":126},"status":"keep","description":"auth_cache negative 缓存加上限防 DoS + relay/flared 删除重复 authenticateAccessToken 改用 agent 共享缓存版","timestamp":1787708052241,"segment":0,"confidence":null,"asi":{"hypothesis":"negative cache 无上限可被伪造 token 撑爆内存；relay/flared 与 agent 三份重复的 authenticateAccessToken","next_action_hint":"继续扫其他无界缓存/限流缺口","result":"metric 持平 8（8 个均为 deliberate keeper），安全修复不计入 metric","security":"negative cache 加 10k 上限+过期清理；relay/flared 复用 agent.AuthenticateAccessToken（共享 2min 正/10min 负缓存，DB 压力下降）"}}
{"run":40,"commit":"0dd2cf9","metric":8,"metrics":{"eslint_errors":0,"eslint_problems":0,"eslint_warnings":0,"golint_canonicalheader":0,"golint_errname":0,"golint_errorlint":1,"golint_exhaustive":0,"golint_forcetypeassert":0,"golint_gosec":0,"golint_intrange":0,"golint_modernize":3,"golint_nilnil":3,"golint_perfsprint":0,"golint_prealloc":0,"golint_recvcheck":1,"golint_test_testifylint":0,"golint_test_thelper":0,"golint_test_total":0,"golint_test_usetesting":0,"golint_total":8,"golint_usestdlibvars":0,"golint_vetx_total":0,"golint_wastedassign":0,"measure_s":77,"tsc_errors":0,"vitest_failed":0,"vitest_total":126},"status":"keep","description":"websocket 三 hub 去重：抽 runWritePump 共享写泵 + 合并 agent 广播函数为 broadcastAgent","timestamp":1787708370650,"segment":0,"confidence":null,"asi":{"hypothesis":"三份 hub 的 writePump 完全重复（仅日志前缀不同），readPump 已有 runReadPump 抽取先例；BroadcastWAFIPGroups/BroadcastActiveConfig 复制粘贴","next_action_hint":"close() 3 份小重复可再合并但收益低；继续找其他模块的重复/无界增长","result":"metric 持平 8，全测试绿","refactor":"新增 websocket/write_pump.go runWritePump（对齐 runReadPump 模式），agent/relay/flared writePump 改委托；agent_hub 抽 broadcastAgent 合并两个广播函数"}}
{"run":41,"commit":"efd8268","metric":8,"metrics":{"eslint_errors":0,"eslint_problems":0,"eslint_warnings":0,"golint_canonicalheader":0,"golint_errname":0,"golint_errorlint":1,"golint_exhaustive":0,"golint_forcetypeassert":0,"golint_gosec":0,"golint_intrange":0,"golint_modernize":3,"golint_nilnil":3,"golint_perfsprint":0,"golint_prealloc":0,"golint_recvcheck":1,"golint_test_testifylint":0,"golint_test_thelper":0,"golint_test_total":0,"golint_test_usetesting":0,"golint_total":8,"golint_usestdlibvars":0,"golint_vetx_total":0,"golint_wastedassign":0,"measure_s":75,"tsc_errors":0,"vitest_failed":0,"vitest_total":126},"status":"keep","description":"websocket 三 client 结构体去重：嵌入共享 wsClientCore（close/enqueue 单份实现）","timestamp":1787708975609,"segment":0,"confidence":null,"asi":{"hypothesis":"agentClient/relayClient/flaredClient 字段与 close/enqueue 完全相同，用组合（嵌入 wsClientCore）消除三份重复","next_action_hint":"代码库经 40 轮已高度收敛；后续可周期性跑 go test -race 全量","result":"metric 持平 8，全测试绿；净减 ~60 行重复代码","refactor":"新增 websocket/client_core.go：wsClientCore(nodeID/conn/send/done/once) + 共享 close/enqueue；三个 client 结构体改为嵌入"}}
{"run":42,"commit":"ed1efd3","metric":8,"metrics":{"eslint_errors":0,"eslint_problems":0,"eslint_warnings":0,"golint_canonicalheader":0,"golint_errname":0,"golint_errorlint":1,"golint_exhaustive":0,"golint_forcetypeassert":0,"golint_gosec":0,"golint_intrange":0,"golint_modernize":3,"golint_nilnil":3,"golint_perfsprint":0,"golint_prealloc":0,"golint_recvcheck":1,"golint_test_testifylint":0,"golint_test_thelper":0,"golint_test_total":0,"golint_test_usetesting":0,"golint_total":8,"golint_usestdlibvars":0,"golint_vetx_total":0,"golint_wastedassign":0,"measure_s":77,"tsc_errors":0,"vitest_failed":0,"vitest_total":126},"status":"keep","description":"补 wsClientCore 并发测试 + close() 防 nil conn 守卫","timestamp":1787709222794,"segment":0,"confidence":null,"asi":{"hypothesis":"wsClientCore 并发语义（close 幂等、enqueue 不阻塞/关后拒绝）无测试覆盖","next_action_hint":"websocket 包已有基础并发测试；继续其他模块扫描","result":"metric 持平 8；测试还暴露 close 未防 nil conn 的防御缺口，已补守卫","refactor":"新增 websocket/client_core_test.go 3 个 -race 测试；client_core.go close() 增加 nil conn 守卫"}}
{"run":43,"commit":"4f8e7e6","metric":8,"metrics":{"eslint_errors":0,"eslint_problems":0,"eslint_warnings":0,"golint_canonicalheader":0,"golint_errname":0,"golint_errorlint":1,"golint_exhaustive":0,"golint_forcetypeassert":0,"golint_gosec":0,"golint_intrange":0,"golint_modernize":3,"golint_nilnil":3,"golint_perfsprint":0,"golint_prealloc":0,"golint_recvcheck":1,"golint_test_testifylint":0,"golint_test_thelper":0,"golint_test_total":0,"golint_test_usetesting":0,"golint_total":8,"golint_usestdlibvars":0,"golint_vetx_total":0,"golint_wastedassign":0,"measure_s":77,"tsc_errors":0,"vitest_failed":0,"vitest_total":126},"status":"keep","description":"修复 frps/frpc TOML 配置注入：新增 protocol.TOMLQuote 并在两处配置渲染全部使用","timestamp":1787709693698,"segment":0,"confidence":null,"asi":{"hypothesis":"frps/frpc TOML 配置用裸 Fprintf 拼接，token/password/域名含引号、反斜杠、换行时会破坏配置或注入键","next_action_hint":"检查其他配置生成点是否有同类注入面（nginx/openresty 配置）","result":"metric 回到 8；frpc 慢套件 16.8s 全绿；mnd 曾短暂+1（Grow 魔法数），删除微优化后消除","security":"新增 pkg/protocol/toml.go TOMLQuote 转义助手 + toml_test.go；relay/frps renderConfig 与 flared/frpc buildFrpcToml 全部插值改为转义输出"}}
{"run":44,"commit":"63007fc","metric":8,"metrics":{"eslint_errors":0,"eslint_problems":0,"eslint_warnings":0,"golint_canonicalheader":0,"golint_errname":0,"golint_errorlint":1,"golint_exhaustive":0,"golint_forcetypeassert":0,"golint_gosec":0,"golint_intrange":0,"golint_modernize":3,"golint_nilnil":3,"golint_perfsprint":0,"golint_prealloc":0,"golint_recvcheck":1,"golint_test_testifylint":0,"golint_test_thelper":0,"golint_test_total":0,"golint_test_usetesting":0,"golint_total":8,"golint_usestdlibvars":0,"golint_vetx_total":0,"golint_wastedassign":0,"measure_s":92,"tsc_errors":0,"vitest_failed":0,"vitest_total":126},"status":"keep","description":"全仓 race 扫描发现 upload/cache 监听器 DATA RACE：捕获 redis 客户端消除全局读竞争 + Stop 等待 done + 同型监听器（oauth×2/repository×2）加固","timestamp":1787711092906,"segment":0,"confidence":null,"asi":{"hypothesis":"全仓 go test -race 可能暴露并发 bug（此前仅局部验证）","next_action_hint":"继续扫其他模块；可考虑把 -race 纳入周期性检查","result":"发现并修复 1 个真实 DATA RACE；修复后全仓 -race 0 竞争，metric 持平 8","root_cause":"upload/cache 监听器 goroutine 读可变全局 db.Redis，与 testhelper 清理置 nil 竞争；testhelper 导入 upload/cache 有循环依赖，故用启动时捕获客户端的根因修复（oauth/repository 同型监听器一并加固），并补 StopUploadMetaCacheListener 同步等待 done"}}
{"run":45,"commit":"63007fc","metric":8,"metrics":{"eslint_errors":0,"eslint_problems":0,"eslint_warnings":0,"golint_canonicalheader":0,"golint_errname":0,"golint_errorlint":1,"golint_exhaustive":0,"golint_forcetypeassert":0,"golint_gosec":0,"golint_intrange":0,"golint_modernize":3,"golint_nilnil":3,"golint_perfsprint":0,"golint_prealloc":0,"golint_recvcheck":1,"golint_test_testifylint":0,"golint_test_thelper":0,"golint_test_total":0,"golint_test_usetesting":0,"golint_total":8,"golint_usestdlibvars":0,"golint_vetx_total":0,"golint_wastedassign":0,"measure_s":70,"tsc_errors":0,"vitest_failed":0,"vitest_total":126},"status":"discard","description":"探索轮：索引对齐/前端请求瀑布/BasicAuth 注入面三假设均证伪，无代码变更","timestamp":1787711474404,"segment":0,"confidence":null,"asi":{"hypothesis":"SQLite 迁移缺 PG 同款索引；前端存在串行请求瀑布；nginx BasicAuth 密码有注入面","next_action_hint":"代码库已高度收敛；下轮可考虑 observability 查询构造器审计或周期性重跑 -race","rollback_reason":"纯探索无代码变更，无需回滚","result":"三个假设均无产出：①索引对比（修正提取正则后）PG/SQLite 完全对齐，SQLite 仅多 legacy w_* 冗余索引；②前端 await Service 均在事件处理器非渲染期；③BasicAuth 密码经 base64 编码（字母表无元字符）无注入面","lessons":"grep 提取 SQL 时注意 IF NOT EXISTS 变体，否则产生假缺口"}}
{"run":46,"commit":"2cb3392","metric":8,"metrics":{"eslint_errors":0,"eslint_problems":0,"eslint_warnings":0,"golint_canonicalheader":0,"golint_errname":0,"golint_errorlint":1,"golint_exhaustive":0,"golint_forcetypeassert":0,"golint_gosec":0,"golint_intrange":0,"golint_modernize":3,"golint_nilnil":3,"golint_perfsprint":0,"golint_prealloc":0,"golint_recvcheck":1,"golint_test_testifylint":0,"golint_test_thelper":0,"golint_test_total":0,"golint_test_usetesting":0,"golint_total":8,"golint_usestdlibvars":0,"golint_vetx_total":0,"golint_wastedassign":0,"measure_s":106,"tsc_errors":0,"vitest_failed":0,"vitest_total":126},"status":"keep","description":"LIKE 过滤器转义修复：日志搜索含 %/_ 的输入不再被当通配符；pkg/util 新增 EscapeLike 共享助手 + 单测","timestamp":1787712116152,"segment":0,"confidence":null,"asi":{"hypothesis":"日志搜索 LIKE 过滤器不转义 %/_/\\，含下划线的路径/主机名搜索结果错误","next_action_hint":"同类遗留站点（upload/user/task_execution GORM 搜索）已记 ideas.md，可作后续轮次","result":"修复 4 个站点：analytics 两处 CH 过滤器 + logstore postgres_store 两处（PG/SQLite 加 ESCAPE '\\'）。新增 pkg/util/like.go EscapeLike + 单测。metric 持平 8，全部测试通过","scope_decision":"GORM 实体搜索站（upload keyword、user username/email）同 bug 类但低风险且可能依赖现有通配语义，本轮不动"}}
{"run":47,"commit":"3528323","metric":8,"metrics":{"eslint_errors":0,"eslint_problems":0,"eslint_warnings":0,"golint_canonicalheader":0,"golint_errname":0,"golint_errorlint":1,"golint_exhaustive":0,"golint_forcetypeassert":0,"golint_gosec":0,"golint_intrange":0,"golint_modernize":3,"golint_nilnil":3,"golint_perfsprint":0,"golint_prealloc":0,"golint_recvcheck":1,"golint_test_testifylint":0,"golint_test_thelper":0,"golint_test_total":0,"golint_test_usetesting":0,"golint_total":8,"golint_usestdlibvars":0,"golint_vetx_total":0,"golint_wastedassign":0,"measure_s":102,"tsc_errors":0,"vitest_failed":0,"vitest_total":126},"status":"keep","description":"GORM 实体搜索 LIKE 转义收尾：6 站点复用 EscapeLike + 显式 ESCAPE 子句，含 OAuth 用户名冲突误报修复","timestamp":1787712555794,"segment":0,"confidence":null,"asi":{"hypothesis":"GORM 实体搜索站与 #46 日志搜索同 bug 类：LIKE 模式不转义通配符","next_action_hint":"LIKE 类已全部收尾；下轮可考虑 ideas.md 的测试可运行性方向或周期性全仓 -race 重跑","result":"6 站点修复（upload keyword、user username/email 前缀+contains、OAuth uniqueUsername base、task_type 前缀），PG/SQLite 加显式 ESCAPE。系统常量模式刻意保留（upload.go:199 image/%）。metric 持平 8，测试全绿","scope_decision":"uniqueUsername 的 base 来自 OAuth 用户信息属外部输入，含 _ 会误报用户名冲突——虽是系统生成后缀模式也需转义 base 本身"}}
{"run":48,"commit":"55db1c0","metric":8,"metrics":{"eslint_errors":0,"eslint_problems":0,"eslint_warnings":0,"golint_canonicalheader":0,"golint_errname":0,"golint_errorlint":1,"golint_exhaustive":0,"golint_forcetypeassert":0,"golint_gosec":0,"golint_intrange":0,"golint_modernize":3,"golint_nilnil":3,"golint_perfsprint":0,"golint_prealloc":0,"golint_recvcheck":1,"golint_test_testifylint":0,"golint_test_thelper":0,"golint_test_total":0,"golint_test_usetesting":0,"golint_total":8,"golint_usestdlibvars":0,"golint_vetx_total":0,"golint_wastedassign":0,"measure_s":112,"tsc_errors":0,"vitest_failed":0,"vitest_total":126},"status":"keep","description":"后台 goroutine panic 防护：新增 pkg/util.Go 共享助手（recover+调用点日志），全仓 22 个裸 go func() 站点统一收口","timestamp":1787713583118,"segment":0,"confidence":null,"asi":{"hypothesis":"全仓 20 处后台 goroutine 裸跑零 recover，任一 panic 击穿 gin handler 级恢复直接崩溃进程","next_action_hint":"goroutine 收口完成；下轮可周期性 go test -race ./... 全量重跑（上次 #44）","result":"pkg/util.Go(fn) 共享助手（runtime.Caller 自动记录调用点 + slog + debug.Stack），22 个站点全部收口（含嵌套 watcher）。脚本转换两轮（首轮漏嵌套内层）。首次 checks_failed 因新文件缺 SPDX 头，update_go_license.sh 修复后全绿。metric 持平 8"}}
{"run":49,"commit":"40232d8","metric":8,"metrics":{"eslint_errors":0,"eslint_problems":0,"eslint_warnings":0,"golint_canonicalheader":0,"golint_errname":0,"golint_errorlint":1,"golint_exhaustive":0,"golint_forcetypeassert":0,"golint_gosec":0,"golint_intrange":0,"golint_modernize":3,"golint_nilnil":3,"golint_perfsprint":0,"golint_prealloc":0,"golint_recvcheck":1,"golint_test_testifylint":0,"golint_test_thelper":0,"golint_test_total":0,"golint_test_usetesting":0,"golint_total":8,"golint_usestdlibvars":0,"golint_vetx_total":0,"golint_wastedassign":0,"measure_s":75,"tsc_errors":0,"vitest_failed":0,"vitest_total":126},"status":"keep","description":"修复 frpc restartProcess 发布未初始化 exec.Cmd 的数据竞争：proc.Cmd/Status 改为 Start 成功后加锁发布","timestamp":1787714358791,"segment":0,"confidence":null,"asi":{"hypothesis":"周期性全仓 go test -race ./... 重跑（上次 #44 后又改了 repository/logstore/goroutine 站点）能抓出新数据竞争","next_action_hint":"-race 全仓清零；下轮候选：frontend axe a11y 审计，或 Go 1.26 新 linter 扫描","result":"全仓 -race 抓到 1 个真实 race：frpc/manager.go restartProcess 在 cmd.Start() 前就发布 proc.Cmd+Status=running（Start 中 cmd.Process 未赋值），测试读句柄与之竞争。修复=Start 成功后再加锁发布（manager.go:219-220 移入 err==nil 分支）。frpc 包 -race 连续 3 次通过。其余全仓 -race 干净"}}
{"run":50,"commit":"40232d8","metric":8,"metrics":{"eslint_errors":0,"eslint_problems":0,"eslint_warnings":0,"golint_canonicalheader":0,"golint_errname":0,"golint_errorlint":1,"golint_exhaustive":0,"golint_forcetypeassert":0,"golint_gosec":0,"golint_intrange":0,"golint_modernize":3,"golint_nilnil":3,"golint_perfsprint":0,"golint_prealloc":0,"golint_recvcheck":1,"golint_test_testifylint":0,"golint_test_thelper":0,"golint_test_total":0,"golint_test_usetesting":0,"golint_total":8,"golint_usestdlibvars":0,"golint_vetx_total":0,"golint_wastedassign":0,"measure_s":70,"tsc_errors":0,"vitest_failed":0,"vitest_total":126},"status":"discard","description":"扩展 linter 发现扫描 + 热路径性能排查：errchkjson/unparam/spancheck 等 9 个新维度，全部核实为不可失败/刻意设计/误报","timestamp":1787714798689,"segment":0,"confidence":null,"asi":{"hypothesis":"基准外发现型 linter（errchkjson/unparam/spancheck/exptostd/durationcheck/makezero/reassign/asasalint/bidichk）+ 热路径性能 grep 能找到真实缺陷","next_action_hint":"发现型 linter 已穷尽；下轮候选：frontend axe a11y 浏览器级审计，或任务执行日志/DB 增长类运维审查","result":"全部证伪：errchkjson 12 处均核实为不可能失败的 marshal（纯 string/int/[]string 结构体；2 处 unsafe 标记是传递性保守）；spancheck 1 处误报（唯一调用方 executor.go:242 有 defer span.End()）；unparam×2 为已评估的工厂签名设计；正则全在包级编译无热路径重编译；包级 map 全为有界静态注册表；AppendLog 走 DB 无内存累积。escapeJSONString 用法正确。无代码变更"}}
{"run":51,"commit":"bbf7919","metric":8,"metrics":{"eslint_errors":0,"eslint_problems":0,"eslint_warnings":0,"golint_canonicalheader":0,"golint_errname":0,"golint_errorlint":1,"golint_exhaustive":0,"golint_forcetypeassert":0,"golint_gosec":0,"golint_intrange":0,"golint_modernize":3,"golint_nilnil":3,"golint_perfsprint":0,"golint_prealloc":0,"golint_recvcheck":1,"golint_test_testifylint":0,"golint_test_thelper":0,"golint_test_total":0,"golint_test_usetesting":0,"golint_total":8,"golint_usestdlibvars":0,"golint_vetx_total":0,"golint_wastedassign":0,"measure_s":72,"tsc_errors":0,"vitest_failed":0,"vitest_total":126},"status":"discard","description":"运行时资源审计：HTTP 客户端超时覆盖 + 查询热路径索引覆盖，两项全部干净无缺陷","timestamp":1787715135724,"segment":0,"confidence":null,"asi":{"hypothesis":"运行时资源审计：出站 HTTP 客户端超时覆盖 + LIKE/精确匹配热路径的 DB 索引支撑","next_action_hint":"两项审计干净。剩余：frontend axe a11y（需起前端+浏览器）、周期性 -race 重跑、uploads LOWER(file_name) contains 若成为性能痛点需改前缀语义+表达式索引","result":"全部干净：15 个 http.Client 中 14 个显式 Timeout，唯一无 Timeout 的 agent/nginx checkStubStatus 走 NewRequestWithContext+WithTimeout 边界；users.username 全部精确匹配热路径由 UNIQUE 内联索引覆盖（PG+SQLite 均确认），email/task_type/logstore 过滤列均已有索引；uploads LOWER(file_name) contains 不可用 b-tree 但属管理端低频，改语义才有收益故不动"}}
{"run":52,"commit":"bbf7919","metric":8,"metrics":{"eslint_errors":0,"eslint_problems":0,"eslint_warnings":0,"golint_canonicalheader":0,"golint_errname":0,"golint_errorlint":1,"golint_exhaustive":0,"golint_forcetypeassert":0,"golint_gosec":0,"golint_intrange":0,"golint_modernize":3,"golint_nilnil":3,"golint_perfsprint":0,"golint_prealloc":0,"golint_recvcheck":1,"golint_test_testifylint":0,"golint_test_thelper":0,"golint_test_total":0,"golint_test_usetesting":0,"golint_total":8,"golint_usestdlibvars":0,"golint_vetx_total":0,"golint_wastedassign":0,"measure_s":71,"tsc_errors":0,"vitest_failed":0,"vitest_total":126},"status":"discard","description":"SQL 注入面 + Go 运行时陷阱模式 + react-hooks 依赖三重审计，全部干净无缺陷","timestamp":1787715503278,"segment":0,"confidence":null,"asi":{"hypothesis":"原始 SQL 拼接注入面 + 经典 Go 运行时陷阱（time.After 循环泄漏/defer-in-loop/context.Background 丢失取消）+ 前端 react-hooks 依赖正确性","next_action_hint":"静态+运行时审计维度已穷尽。剩余唯一大项：frontend axe a11y 浏览器级审计（需起前端 dev server + agent_browser）","result":"全部干净：db_manage SQL 控制台为管理端允许例外且表名双引号转义正确、analytics Sprintf 均内部常量表名+参数化占位符；time.After 仅 3 处且均为 select 单次等待/有界重试；defer 均在函数级非循环内；19 处 context.Background() 全部为后台监听器（WithCancel）/重启路径/自带超时的清理任务，无请求 ctx 丢弃；react-hooks/exhaustive-deps 全仓零违规（CLI 临时规则，未改配置）"}}
{"run":53,"commit":"bbf7919","metric":8,"metrics":{"eslint_errors":0,"eslint_problems":0,"eslint_warnings":0,"golint_canonicalheader":0,"golint_errname":0,"golint_errorlint":1,"golint_exhaustive":0,"golint_forcetypeassert":0,"golint_gosec":0,"golint_intrange":0,"golint_modernize":3,"golint_nilnil":3,"golint_perfsprint":0,"golint_prealloc":0,"golint_recvcheck":1,"golint_test_testifylint":0,"golint_test_thelper":0,"golint_test_total":0,"golint_test_usetesting":0,"golint_total":8,"golint_usestdlibvars":0,"golint_vetx_total":0,"golint_wastedassign":0,"measure_s":72,"tsc_errors":0,"vitest_failed":0,"vitest_total":126},"status":"discard","description":"前端 axe a11y 浏览器审计：唯一违规为无后端环境产物，无代码缺陷","timestamp":1787716027952,"segment":0,"confidence":null,"asi":{"hypothesis":"前端 axe-core 浏览器级 a11y 审计（最后一个未探索大维度）","next_action_hint":"a11y 维度已探索但受登录墙限制：完整审计需起后端+种子账号登录。若未来重跑：起 Go 后端 + admin 登录后逐页 axe.run","result":"agent-browser 0.34.0 已装好可复用。axe 审计覆盖所有无认证可达页面（/login、/register、/docs/* 全被登录墙拦截）：唯一违规 page-has-heading-one 是环境产物——后端未启动时页面卡在 session-check/publicConfig-pending 态只渲染 Spinner，真实表单的 AuthHeading h1 未渲染；瞬态态用 h3 属可接受的瞬态层级。无代码缺陷。已认证页面需后端才能审计"}}
