{"run":54,"commit":"451ce52","metric":8,"metrics":{"eslint_errors":0,"eslint_problems":0,"eslint_warnings":0,"golint_canonicalheader":0,"golint_errname":0,"golint_errorlint":1,"golint_exhaustive":0,"golint_forcetypeassert":0,"golint_gosec":0,"golint_intrange":0,"golint_modernize":3,"golint_nilnil":3,"golint_perfsprint":0,"golint_prealloc":0,"golint_recvcheck":1,"golint_test_testifylint":0,"golint_test_thelper":0,"golint_test_total":0,"golint_test_usetesting":0,"golint_total":8,"golint_usestdlibvars":0,"golint_vetx_total":0,"golint_wastedassign":0,"measure_s":93,"tsc_errors":0,"vitest_failed":0,"vitest_total":126},"status":"keep","description":"认证页 axe a11y 审计+修复：7 处布局级真实违规全修，复扫验证 dashboard/admin/system 归零；基准 total_issues 保持 8 不变（纯质量收益）","timestamp":1787718397798,"segment":0,"confidence":null,"asi":{"hypothesis":"认证页 axe a11y 审计（起后端+登录突破登录墙）：修复布局级真实违规","next_action_hint":"已验证 / 与 /admin/system 归零。剩余页面级：admin 表格行内操作按钮/Switch 无 aria-label、muted 文本对比度——需逐表补标签，工作量大已归档 ideas.md","result":"修复 7 处全局问题并复扫验证：sidebar 折叠按钮 aria-label、Sidebar role=navigation（region 违规 18 节点/页清零）、header Kbd 对比度 text-foreground/70（每页 1 处）、dashboard 4 个 Progress aria-label、分页按钮 aria-label、空态/错误/加载 h3→p（heading-order 清零）、admin/system 无内容 Tabs 改 aria-pressed 按钮组（aria-valid-attr-value critical 清零）。dashboard 与 admin/system 现 0 违规","setup":"审计环境：后端 go run . api @:3100（CONFIG_PATH=/tmp/of-audit/config.yaml，sqlite+redis host 网络 docker）、前端 pnpm dev --port 3002（WAVELET_BACKEND_URL=:3100）、admin 密码经 reset-passwd 重置"}}
{"run":55,"commit":"e66dea9","metric":8,"metrics":{"eslint_errors":0,"eslint_problems":0,"eslint_warnings":0,"golint_canonicalheader":0,"golint_errname":0,"golint_errorlint":1,"golint_exhaustive":0,"golint_forcetypeassert":0,"golint_gosec":0,"golint_intrange":0,"golint_modernize":3,"golint_nilnil":3,"golint_perfsprint":0,"golint_prealloc":0,"golint_recvcheck":1,"golint_test_testifylint":0,"golint_test_thelper":0,"golint_test_total":0,"golint_test_usetesting":0,"golint_total":8,"golint_usestdlibvars":0,"golint_vetx_total":0,"golint_wastedassign":0,"measure_s":85,"tsc_errors":0,"vitest_failed":0,"vitest_total":126},"status":"keep","description":"a11y 收尾：主题级对比度根因修复（indigo-500→600）+12 处控件 accessible name+4 处 heading-order，7 页复扫全 0 违规；基准 total_issues 保持 8","timestamp":1787719908229,"segment":0,"confidence":null,"asi":{"hypothesis":"页面级 a11y 批量收尾：主题级 color-contrast 根因 + 表格/表单控件 accessible name","next_action_hint":"7 页复扫全 0 违规。剩余：其余页面（websites/origins/cloudflare 等仅扫过 contrast 已由主题修复覆盖）可抽查；-race 周期重跑","result":"根因1：--primary indigo-500(#6366f1) 对 #fafafa 仅 4.27 → 改 indigo-600 oklch(51.1% 0.262 276.966)（~6.8 AA），全站 contrast 清零（一处主题修复覆盖所有页面）。修复 12 处控件名：access-analytics 刷新按钮、events-tab Switch/edit/delete、openflare-ops ToggleRow Switch+geoip/kuma Select+FieldInput Input htmlFor+discovery Textarea、table-browser/sql-console SelectTrigger；heading-order：cache-manager/user-detail-sheet h4→p、task-manager h3→p、file-manager noFiles h3→p；新增 admin.logs.analytics.refresh i18n 键(en/zh)+merge-i18n-fragments。教训：settings 表单异步渲染，早前扫描漏报 label 违规需 wait 5s 后再 axe.run；Radix SelectValue value='' 时 placeholder 不显示致 combobox 无名，须 aria-label 兜底","setup":"审计环境同 run#54：后端:3100(sqlite) + docker redis host 网络 + pnpm dev --port 3002"}}
{"run":56,"commit":"63e3b85","metric":8,"metrics":{"eslint_errors":0,"eslint_problems":0,"eslint_warnings":0,"golint_canonicalheader":0,"golint_errname":0,"golint_errorlint":1,"golint_exhaustive":0,"golint_forcetypeassert":0,"golint_gosec":0,"golint_intrange":0,"golint_modernize":3,"golint_nilnil":3,"golint_perfsprint":0,"golint_prealloc":0,"golint_recvcheck":1,"golint_test_testifylint":0,"golint_test_thelper":0,"golint_test_total":0,"golint_test_usetesting":0,"golint_total":8,"golint_usestdlibvars":0,"golint_vetx_total":0,"golint_wastedassign":0,"measure_s":85,"tsc_errors":0,"vitest_failed":0,"vitest_total":126},"status":"keep","description":"富交互页 a11y 抽查收尾：8+3 页扫描，修复 cloudflare 筛选器无名/access-token amber 对比度/notifications 缺 h1 共 3 处，全部复扫归零；基准 total_issues 保持 8","timestamp":1787720716912,"segment":0,"confidence":null,"asi":{"hypothesis":"富交互页抽查（websites/origins/proxy-routes/certificates/cloudflare/dns-accounts/settings 子页）","next_action_hint":"11 页扫描全部归零，a11y 维度已穷尽。剩余：周期性 -race 重跑；审计环境复用法在 ideas.md","result":"websites/origins/proxy-routes/certificates/dns-accounts 5 页直接 0 违规（主题修复覆盖）；3 处新发现全修复并复扫验证：cloudflare 同步面板状态筛选 SelectTrigger 加 aria-label(statusPlaceholder)；access-token 安全提示 amber-600→amber-700(12px 小字对比度 4.5 不达标)；notifications 面包屑页加 sr-only h1——教训：h1 不能放 BreadcrumbList 内(破坏 list 语义 axe list 规则)，BreadcrumbPage 无 asChild 需放 Breadcrumb 外","setup":"审计环境同前：后端:3100 + docker redis host 网络 + pnpm dev --port 3002"}}
{"run":57,"commit":"453f7e5","metric":8,"metrics":{"eslint_errors":0,"eslint_problems":0,"eslint_warnings":0,"golint_canonicalheader":0,"golint_errname":0,"golint_errorlint":1,"golint_exhaustive":0,"golint_forcetypeassert":0,"golint_gosec":0,"golint_intrange":0,"golint_modernize":3,"golint_nilnil":3,"golint_perfsprint":0,"golint_prealloc":0,"golint_recvcheck":1,"golint_test_testifylint":0,"golint_test_thelper":0,"golint_test_total":0,"golint_test_usetesting":0,"golint_total":8,"golint_usestdlibvars":0,"golint_vetx_total":0,"golint_wastedassign":0,"measure_s":95,"tsc_errors":0,"vitest_failed":0,"vitest_total":126},"status":"keep","description":"周期性 -race 重跑抓到真实 bug：wsClientCore.enqueue close 后 select 随机选择致契约违反；确定性先查 done 修复+测试循环加固+gofmt 存量漂移清理","timestamp":1787721299485,"segment":0,"confidence":null,"asi":{"hypothesis":"周期性全仓 -race 重跑（上次干净为 run #49）","next_action_hint":"websocket 包 -race 10×count=1 全过。教训已记录：select 多 case 同时就绪时随机选择，closed 检查须独立 select 先行；replace 工具锚点选错会级联破坏文件，小文件直接 write 重写更安全","root_cause":"enqueue 把 closed 检查与发送合并在同一个 select，两 case 同时就绪时 Go 随机选择，close 后约 50% 概率仍投递成功——违反 fail-fast 契约且测试 flaky。修复=独立 select 确定性先查 done；测试加固为循环 50 次","result":"抓到真实 bug：wsClientCore.enqueue close 后非确定返回 true（TestWSClientCoreEnqueueFailsAfterClose 必失败）。调用方 agent_hub×3 语义无影响（false=丢弃本就正确）。顺带修 3 个 hub 文件存量 gofmt 漂移","scope_note":"-race 重跑仅 websocket 包 1 个 FAIL，其余 internal/... pkg/... 全部通过"}}
{"run":58,"commit":"fc733d0","metric":8,"metrics":{"eslint_errors":0,"eslint_problems":0,"eslint_warnings":0,"golint_canonicalheader":0,"golint_errname":0,"golint_errorlint":1,"golint_exhaustive":0,"golint_forcetypeassert":0,"golint_gosec":0,"golint_intrange":0,"golint_modernize":3,"golint_nilnil":3,"golint_perfsprint":0,"golint_prealloc":0,"golint_recvcheck":1,"golint_test_testifylint":0,"golint_test_thelper":0,"golint_test_total":0,"golint_test_usetesting":0,"golint_total":8,"golint_usestdlibvars":0,"golint_vetx_total":0,"golint_wastedassign":0,"measure_s":77,"tsc_errors":0,"vitest_failed":0,"vitest_total":126},"status":"keep","description":"#57 enqueue 修复的同型残留收口：SendFlaredPong/SendRelayPong 合并 select 随机选择 bug，委托 client.enqueue 去重修复","timestamp":1787721635717,"segment":0,"confidence":null,"asi":{"hypothesis":"#57 修复 enqueue 后，grep 全 hub 同型合并 select——发现 SendFlaredPong/SendRelayPong 残留相同 bug","lesson":"修一个 bug 后应 grep 所有同型调用点（本会话 run #44/#46/#57 三次都是同型残留收口模式）；委托共享 enqueue 是去重+根因一步到位","next_action_hint":"websocket 并发面已全清。下轮可做：周期性全仓 -race 或 go test -count=10 稳定性抽查","root_cause":"SendFlaredPong (flared_hub.go) 与 SendRelayPong (relay_hub.go) 把 case <-client.done 与 case client.send <- 合并同一 select，两 case 同时就绪时 Go 随机选择，close 后仍可能投递成功。修复=委托 client.enqueue（内含确定性先查 done），同时消除重复代码"}}
{"run":59,"commit":"b56f276","metric":8,"metrics":{"eslint_errors":0,"eslint_problems":0,"eslint_warnings":0,"golint_canonicalheader":0,"golint_errname":0,"golint_errorlint":1,"golint_exhaustive":0,"golint_forcetypeassert":0,"golint_gosec":0,"golint_intrange":0,"golint_modernize":3,"golint_nilnil":3,"golint_perfsprint":0,"golint_prealloc":0,"golint_recvcheck":1,"golint_test_testifylint":0,"golint_test_thelper":0,"golint_test_total":0,"golint_test_usetesting":0,"golint_total":8,"golint_usestdlibvars":0,"golint_vetx_total":0,"golint_wastedassign":0,"measure_s":66,"tsc_errors":0,"vitest_failed":0,"vitest_total":126},"status":"keep","description":"#59 -shuffle=on 扫描抓到测试顺序依赖：config_version RAM 配置缓存跨测试污染，setup/cleanup 接入 ram.ResetForTest() 修复","timestamp":1787722520315,"segment":0,"confidence":null,"asi":{"hypothesis":"-shuffle=on 测试顺序随机化扫描（未查过的维度），暴露测试间共享状态依赖","lesson":"repository 读配置会写进程级 RAM 缓存（ram.Set，TTL 跨测试存活）；测试用 :memory: DB + SetDB 换库时缓存不随之失效。默认源码顺序下 Defaults 先跑掩盖了问题。-shuffle=on 是暴露此类顺序依赖的低成本手段，可周期重跑","next_action_hint":"全仓 shuffle 已干净。下轮候选：-count 多轮稳定性、或从 ideas.md 剩余条目挑；明确不做清单见 ideas.md","root_cause":"TestBuildOpenRestyConfigSnapshotOriginErrorPageDefaults 在 shuffle 下命中 Custom 用例留在进程级 RAM 配置缓存的 enabled=false/[\"522\",\"500-502\"]（GetSystemConfigByGroup 未命中时 ram.Set 回填）。修复=两个测试 setup（setupOriginErrorPageSnapshotDB/setupConfigVersionTestDB）接入既有 ram.ResetForTest()：换 DB 前后各清一次"}}
